Record Number	Title
1	Supreme Nike SB Dunk High By any Means Red US10 EU44 Supreme Box Logo Air Force
2	New Balance 530 Männer und Frauen Laufschuhe mit Buchstaben N bequeme Laufschuhe
3	♥ MICHAEL KORS Sneaker Gr 39 ♥
4	New Balance ML 574 EGO Turnschuhe grün
5	Nike air jordan 9 og , space jam , hare , bugs bunny , EU 45 / US 11 NEU + RECHNUNG
6	NEU SKECHERS Damen Sneakers Turnschuhe Memory Foam MODA - LAZY SUNDAYS Blau
7	New Balance 550 White Green
8	CAT CATERPILLAR Arise Sneaker Freizeitschuhe Turnschuhe Schuhe Herren Neuheit
9	Adidas NMD R1 STLT PK Primeknit Sneaker Turnschuhe CQ2388 blau Gr . 36 - 42 NEU
10	Damen Sneaker Mesh Sportschuhe Laufschuhe Slip On Turnschuhe Flache Sockenschuhe
11	Art 505 Schuhe Sneaker Sportschuhe Herren
12	C2886 sneaker uomo LANVIN VEGO scarpa nero multi stripes shoe man
13	New Balance 574 Herren-Sneaker Low Leder Retro-Schuhe 2022 ML574TD2 Weiß / Grün
14	Ecco ST. 1 Lite Herren Halbschuhe Schnürer Sneaker Leder 504194-51220 Gr . 44
15	SCHUHE HALBSCHUH SNEAKER HI-TEC LEDER Gr . 43 SCHWARZ GUT
16	WODEN Sneaker NORA II PLATEAU Schwarz WL1750-020 Echtleder Textil Damen
17	Puma Carina L Damen Schuhe Sneaker Turnschuhe 370325 ( Schwarz 01 )
18	adidas Originals CAFLAIRE Herren Sneaker Weiß EE7599 Freizeit Sport Schuhe NEU
19	Gay Used Kroko Sneaker sexy Hot 42
20	Nike Jordan 1 Low ( W ) Marina Blue | Größe 40,5 - 44 | NEU | DC0774-114 | Sneaker
21	NIKE FREE RUN 2 36.5-38 .5 NEU 99 € 5.0 4.0 3.0 rosherun rosheone flex lite kaishi
22	Damen Sportschuhe Laufschuhe Sneaker Stoffschuhe Strick Schnürer Fitness 60860
23	Neu IN Box Neu Herren ASICS Gel-Quantum 360 CM Schuhe 1021A134 .022
24	Herren Damenschuhe Laufschuhe Atmungsaktiv Mesh Running Shoes Sneaker Gr.35-45
25	Nike Air Jordan 5 / V 3Lab5 45 " Metallic " Black / Black-Metallic Silver
26	KEEN Schnürschuh Ridge Flex Mid WP 1024916 magnet / black ( grau ) NEU
27	NEU Puma Ignite Avid EvoKnit Größe 42 Herren Schuhe Sneaker 365392-01 SCHWARZ
28	Puma Speedcat RDL FS Weiß white 375938-01 Herren Schuhe Men Running Sneaker shoe
29	NEU SKECHERS Damen Sneakers Freizeitschuhe ULTRA FLEX 2.0 - LASER FOCUS Blau
30	jenny by ara Glendale
31	Puma Mantra FUSEFIT Herren Outdoor Fitnessschuhe Sneaker 191427 03
32	Original Gucci Sneaker Gr .37,5 / 38
33	Nike Epic React Flyknit 2 Gr .44 M Sneaker schwarz BQ8928 001 Running Schuhe Unis
34	Reebok Classic Royal Glide LX Gr . 43 / US 10 / 28 cm - Artikel # BS7991 black
35	! Supergeiler Adidas Originals Superstar II Sneaker Gr 41 Herren Freizeit Schuhe !
36	Puma Retro Sneaker Echtleder " Smash v2 " puma black - puma black
37	PUMA Ferrari Future Cat Ultra ( 306241-01 ) Rot Mens Sneaker Trainers - NEU OVP
38	Sportschuhe Herren Adidas Terrex Tracerocker GTX Größe 45 10 1/2 Schwarz
39	Legero Damen Sneaker Echtleder NEU - A-Ware
40	BÄR schuhe damen 40 , Schwarz , Modell Arnstein , 1x Getragen , Neupreis 209 €
41	B1974 sneaker donna TOD 'S SPORTIVO YO ALLACCIATA argento / blu shoe woman
42	Onitsuka Tiger Rebilac Runner Herren Freizeit Retro Schuhe Sneaker 1183A396-750
43	Skechers Bounder Herren Schuhe Sneaker Turnschuhe 52504 ( Weiß-WHT )
44	Art 121 Neon Turnschuhe Schuhe Sneaker Sportschuhe Neu Herren
45	Lacoste Lewiston AP SRM dk brown Schuhe / Sneaker Größenauswahl
46	Balerinas Stoffschuhe Retro gr 39 gerne Getragen Sandalen Gebraucht Sammler
47	Skechers Bobs Squad Breeze Way Damen Sneaker | Turnschuh | Sportschuh | Textil -
48	Puma Smash Wns V2 SD Damen Schuhe Sneaker Turnschuhe 365313 10 Leder Soft Foam
49	ROOS RED RAMSES 47070 Erwachsenen Sneaker Turnschuhe Halbschuhe Neu Braun / Blau
50	PUMA Evolution Play Black and White Sneaker Schuhe Männer Neu
51	ORIGINAL ADIDAS GAZELLE J CQ2874 DAMEN SNEAKER TURNSCHUHE FITNESS BURGUNDER
52	Art 872 Übergröße Luftpolster Turnschuhe Schuhe Sneaker Sportschuhe Laufschuhe
53	Herren Laufschuhe Atmungsaktiv Sports Freizeitschuhe Sockenschuhe Gr . 39-44
54	New Balance M1991 XG grey Sneaker Schuhe Made in England grau
55	Herren Sneaker Trekkingschuhe Outdoor Wanderschuhe Freizeitschuhe Schwarz 44
56	Damenschuhe Plateau Halbschuhe Light Slipper Sneaker Turnschuhe Ballerina Mesh
57	Nike Air Zoom SuperRep 2 Herren Trainingsschuhe Schwarz-weiß Gr .42,5 . NEU !
58	NEU Dockers Herrenschuhe Schuhe Sneaker Canvas Halbschuhe Schnürschuhe Freizeit
59	moncler Monaco
60	Reebok Classic Leather 36 37 38 38,5 39 40 BS7898 melted metals princess spirit
61	Converse Chucks Sneaker All Star Taylor High Turnschuh Schuhe Canvas Miley Cyrus
62	Nike Air Max 97 RFT ( GS ) Gr . 36,5 Neu & OVP BQ8437 001 Damen Kinder Sneaker
63	Lico by Sparco Mecha Alltagsschuhe Turnschuhe Sport 36
64	Nike Grandstand II 36 38 40 40,5 41 42 classic blazer Tennis AA2190 100
65	Nike SB Dunk Low Civilist CZ5123-001
66	Adidas München Oktoberfest MIG Sneaker Turnschuhe BY9805 braun Leder 38,5-41 NEU
67	Herren Luftpolster Laufschuhe Jogging Fitness Tennis Workout Bequem Mode Sneaker
68	Skechers Arch-Fit PARADYME Herren Sneaker 232041 BBK schwarz
69	Converse Chucks Taylor All Star Ctas Ox Low Damen Schuhe Sneaker 560648C ( Weiss )
70	Onitsuka Tiger Corsair Gelb Herren Freizeit Retro Schuhe Sport Sneaker
71	Esgano High Sneaker blau jeans Leder used Sohle weiß 0341500 274 Reißverschluß
72	Nike Air Force 1 Herren White Leder & Synthetik Sneaker Mode
73	adidas Continental 80 38 38,5 39 42,5 43 B41673 80 's sTaN sMiTh rOd LaveR LeNdl
74	Herren Damen Laufschuhe Profilsohle Sportschuhe Schnürer Fitness 810679 Schuhe
75	Hackett Sneaker , Winfield , Gr .40 , Neu
76	TOP NIKE AIR MAX PLUS NIC QS Gr .43 " MULTI COLOR " AO5117 100 * NEU * WM 2018 * RUSSIA
77	NEU Converse CT All Star Selene Monochrome Leather Women Gr . 39 Chuck Taylor
78	ASICS HERREN TURNSCHUHE FREIZEITSCHUHE SNEAKER ART . GEL-LYTE III H5E3L
79	Kappa Sneaker Unisex Turnschuh 242765 schwarz
80	New Balance ML 574 EGK Classic Sneaker Herren Schuhe schwarz
81	Vans SK8-HI Slim ( Della ) batik / red Sneaker / Schuhe QG3AWF rot
82	DANIEL HECHTER Herrenschuhe Slipper Mokassins Echtleder braun cognac NEU
83	Art 850 Turnschuhe Schuhe Sneaker Sportschuhe Luftpolstersohle Herren
84	Sportschuhe Sneaker Turnschuhe Laufschuhe Herrenschuhe Freizeit Schnürer 62156
85	Adidas EZ QT MID Ladies Trainers Echtleder schwarz / weiss Neu !
86	Damen schuhe MBT 35 sneakers grau textil dynamic AB390-35
87	Herren Sneaker Sportschuhe Turnschuhe Laufschuhe Freizeit Schwarz Blau 17159
88	NIKE Air MAX DARWIN 360 90 95 97 Neu Gr :43 US :9,5 White Weiß Sneaker jordan kobe
89	New Balance WL393RG1 grau / hellblau , Damen Sneaker , NEU im Karton
90	PUMA DRIFT CAT 5 BMW NM Herrenschuhe Sneaker Turnschuhe Halbschuhe 42,5 44,5
91	Nike Air Force 1 Pixel White ( W ) Weiß NEU Sneaker Schuhe CK6649-100
92	Herren Sneaker Outdoor Trekkingschuhe Wanderschuhe Schnürer 145380
93	Emerica Wino Cruiser black white green Sneaker Schuhe schwarz
94	K-Swiss Court Palisades Herren Schuhe Sneaker Turnschuhe 06931 ( Weiß 171 )
95	Lacoste Carnaby EVO 118 Damen Sneaker Weiß 7-35SPW0013216 Freizeit Schuhe NEU
96	Asics Damen Gel-Kinsei OG Turnschuhe Laufschuhe Sneaker Weiß Sport
97	Asics GEL LYTE V GS H70TQ 0101 Weiß Schuhe Laufschuhe Sneaker H70TQ0101 Neu !
98	ARKK Copenhagen Damensneaker - 60 % unter UVP
99	Damen Sneaker Freizeitschuhe Footflexx Komfortschuhe G-Weite 37 38 39 40 41 NEU
100	Nike Air Max Huarache Blau Türkis SONDERMODELL , EU 38,5 , * wie neu *
101	Puma SF Future Cat Ultra Ferrari Jungen Sneaker Freizeitschuhe Gr : wählbar neu o
102	Adidas Ultra Boost 20 Herren Sneaker Laufschuhe Turnschuhe schwarz FV8329 NEU
103	Nike Air Max White Turquoise EU Größe 46 - Sammlerstücke Used Gay Sniff
104	Adidas Originals ZX 8000 Leder 2011 EUR 43 1/3 US 9,5 UK 9 SCHWARZ NEU ECHT
105	Herrenschuhe Damen Running Sportschuhe Turnschuhe Freizeitschuhe Laufschuhe Gr46
106	NEU SKECHERS Damen Sneakers Turnschuhe Walking Slip On YOU DEFINE Grau
107	Womens Men Adidas Courtvantage PK Primeknit Neu Superstar Gr :39 1/3 S80431
108	NEU Nike WMNS Free 5.0 TR Fit 5 Print Gr 38 Laufschuhe Running 704695-010
109	Nike Revolution 5 ( GS ) Kinder Damen Sneaker Laufschuhe Schuhe BQ5671 020 Gr . 38
110	ADIDAS GALAXY 5 Herrenschuhe Turnschuhe Laufschuhe Running Sneaker Sportschuhe
111	Herren Weiß Running Sneaker Sportschuhe Turnschuhe Freizeitschuhe Laufschuhe
112	Adidas Originals U_Path Run Schuhe Sneaker Herren Damen G27639 Schwarz
113	Nike Air Command Force Billy Hoyle 2014 90 bw og vintage dunk 1 sb tn jordan 90
114	Globe Tilt Herren-Skateschuhe Sneaker Skaterschuhe Sportschuhe Schuhe
115	Fila DISRUPTOR II Damen-Sportschuhe [ 002 125 ] Neu
116	Adidas Q22919 ADI Lago Low Leder Herren Schuhe Sport Running Sneaker 47 48 Black
117	Nike Sneaker Revolution blau Herrensneaker Schuhe Herren 819300 402
118	Nike Air Max AP Sneaker Schuhe Sportschuhe Herren Schwarz CU4826 002
119	asics Gel - Venture 8 1011A824-004
120	Palladium Slim Snaps black / off white Schuhe / Sneaker schwarz Größenauswahl !
121	Damen Sportschuhe Puma Carina Lift [ 373031 06 ] Sneaker NEU Leder
122	Damen Plateau Sneaker Keilabsatz Schnürer Profil-Sohle Schuhe 836214 Trendy Neu
123	Only Damen Schuhe Sneaker Turnschuhe weiß Sportschuhe Freizeitschuhe onlSHILO
124	Asics Gel-Lyte V 5 Sneaker Turnschuhe Sportschuhe Freizeit Schuhe HL7W1-3131
125	Nike Air Max LTD 3 Gr . wählbar Neu & OVP 687977 111
126	Brütting Turnschuh schwarz / grau & weiss / blau Klettverschluss Damen Herren Halle
127	Schuhe Turnschuh Gr . 40 Rot Schnürschuh Leicht Top Damen Herren Stoff @ Snaker
128	adidas Run 80s Sneaker Herren - beige / lila
129	Timberland Chukka Bayham Leder Herrensneaker ( A19DA ) Grau Gr : wählbar in Karton
130	Adidas Originals NMD R1 Gr . 45,5 / US 11 / 29 cm Artikel # BD7745 black schwarz
131	Adidas Terrex Eastrail GTX Gore-tex wasserabweisend Trekking carbon schwarz
132	AF1 Shadow x Black & White handbemalt custom Sneaker personalisiert Schwarz
133	Nike Cortez Classic leather se 47,5 bruin blazer jordan 861535 301
134	adidas Originals X PLR Herren Sneaker Blau AH2357 Sport Fitness Freizeit Schuhe
135	SKECHERS " DYNAMIGHT 2.0 " DAMEN SCHUHE SNEAKER SCHNÜRER SCHWARZ GR . 38 NEU
136	Herren Schuhe Freizeit Laufenschuhe Mode Rutschfest Sport Running Sneaker Gym
137	adidas Originals Superstar 80s BZ0650 Turnschuhe Summer Beach Adilette Palme Eis
138	Skechers D Lites Fan Love Damen Sneaker 13140-GYPK Grau Sportschuhe Schuhe NEU
139	adidas CC 1 Clima CooL 39 40 42 43 44 cOnSorTium zX BA8573 cc1 support
140	Skechers Gowalk4 Damen Slipper Schuhe Sneaker Turnschuhe 14148 ( Schwarz-BKW )
141	Adidas Herren Hallenschuhe ACE 15.1 BOOST 46 2/3 schwarz-gelb NEU B25500
142	Nike W Air Max 720 AR9293-001 Metallic Silver / Midnight Navy Schuhe Sneaker
143	Asics Gel Lyte 3 Herren Sportschuhe Sneaker EUR 47 21-A-3092
144	KEDS DAMEN SCHUHE SCOUT CHAKKA BOOTS OLIVE GRÜN GREEN WF60609
145	Adidas Tubular Runner Baby Schuhe pink - Fahion Sneaker für die ganz Kleinen
146	Herrenschuhe Adidas Porsche Design S 2 Schwarz Silber Größe 9,5 heiss
147	Ecco Biom 2.0 GTX Herren Halbschuhe Schnürer Schuhe Sneaker 800664-51052
148	Adidas Porsche Design Travel Tourer Sneaker Turnschuhe Schuhe BB5541 NEU Gr . 42
149	ORIGINAL ADIDAS VS PACE FY8579 HERREN TURNSCHUHE LAUFEN FITNESS SPORT SCHWARZ
150	2022 New Balance 574 Schuhe Damen Freizeit Running Sneaker Schuhe neu
151	Nike Jordan 1 Low Bred Toe | Sneaker | Limited | 43 NEU !
152	Salomon ALPHACROSS GTX W - GORE-TEX - 408056 Trail-Running Schuhe Wanderschuhe
153	adidas x NASA - NMD R1 Spectoo - FX6819 Sneaker Schwarz Freizeit Sport Schuhe
154	adidas ULTRABOOST CC_1 DNA Turnschuhe Sneaker FZ2545 White Weiß Herren Originals
155	Lacoste Chaymon BL 1 Sneaker Schuhe Herren Dunkelblau 37CMA0094 092
156	BULLBOXER Herren Sneaker Schnürschuhe Freizeitschuhe Boots Schuhe Leder braun
157	Nike Air Max Zephyr ( CN8511 001 )
158	892817 Flache Damen Herren Sneakers Low Stoffschuhe Schnürer Viele Farben Mode
159	Fila Orbit F Low Damen Sneaker | Turnschuh | Sportschuh | Leder - NEU
160	HERREN ASICS GEL HUNTER 3 TRAININGSSCHUH SPORTSCHUH BLAU GELB R507Y 41,5 NEU
161	Damen Sneaker Wedges Schnürer Keilabsatz Plateau Stoff 836273 Schuhe
162	UNDER ARMOUR Charged Commit TR 3 3023703-103 Trainingschuhe Turnschuhe Herren
163	Puma Herren Axis Laufschuhe Sportschuhe Turnschuhe Sneaker
164	Turnschuh gr .41 herren von criss cross
165	HERREN SCHUHE SNEAKERS NEW BALANCE [ CM996SHD ]
166	PUMA Tsugi Jun Cubism EU 42,5 US 9,5 Laufschuhe 365490-02 Schwarz Low Tops
167	Adidas Tubular Runner weinrot weiß Herren Mid-Cut Sneakers Freizeitschuhe NEU
168	NEU TAMARIS Damenschuhe Schuhe Plateau Sneaker Halbschuhe Lederschuhe Schnürer
169	VITAFORM Damen-Sneaker Nappa & Stretch buntes Stretchband Haifischsohle
170	Levi 's Herren Sneaker Declan 2.0 Schuhe Männer Turnschuhe schwarz
171	Adidas Solar Glide 19 M Herren Laufschuhe Sneaker Turnschuhe schwarz G28062 NEU
172	NIKE FREE 4.0 V3 SNEAKER LAUFSCHUHE SCHUHE FLYKNIT FLYWIRE PRESTO 38 39 SELTEN
173	JEPARA Men 's Laufen Jogging Walking Freizeit Laufschuhe Sportschuhe
174	LI-NING C324 - Turnschuhe / Laufschuhe / Sportschuhe - Größe : EUR 37 / UK 4 NEU
175	Merrell Vapor Glove 4 Herren Barefoot Schuhe J50403 Barfußschuhe Grau NEU
176	Damen Herren Sneakers Low Cut Canvas Schuhe Basic Schnürer 811545 Trendy Neu
177	Schuhe Herren Brown Lacoste Chaymon [ 094DB2 ] Leder
178	Lyle & Scott Mitchell White Textile Lace Up Mens Trainers FW1008 626
179	Puma R78 Unisex Sneaker Low Top Turnschuhe 373117 Palace Blue Puma Black
180	Timberland Davis Square Gr . 36 Neu & OVP OA283N Kinder Damen Stiefel
181	COLUMBIA Facet 30 Outdry BM1821010 Wasserdichte Wanderschuhe Turnschuhe Herren
182	Columbia Herren Verstellbar Sport Sandalen Grippy Riemen Wandern Wasser Größen 9
183	Fila Herren Mastermind Heritage Komfort Schuhe Turnschuhe Sneaker Schnürung Weiß
184	REEBOK CLUB C 85 white royal gum AR0459 NEU
185	Ecco MX Gore-Tex Herren Halbschuhe Schnürer Schuhe Sneaker Leder 820194 51647
186	Puma Carina Lift Damen Schuhe Sneaker Turnschuhe 373031
187	New Balance SMF 200 BY
188	Skechers Sneaker Med Graceful - Get Connected - Lavendel Polyester Normal Damen
189	Adidas Bed JW Ford x Kamanda BF Sneaker Turnschuhe schwarz EF3830 Gr 38 - 44 NEU
190	Skechers O-T-G Womens Boots ON-THE-GO JOY AGLOW Sneakers Damen Braun
191	Clarks Originals Trigenic Evo Suede Textile Sports Lace-Up Herren Trainer
192	Brütting Performance V , Kinder / Damenschuhe Sportschuhe Klett , Gr . 36
193	Nike Air Jordan Why Not Zero .2 Black White Gold Größe 41 schwarz AO6219 001 Zero
194	HERMÈS SNEAKERS BRIDES DE GALA IN SCHWARZ
195	Redskins UPWARDAN beige / blau Herrensneaker Freizeitschuhe Glattleder NEU
196	Vivobarefoot Damen Trainer Primus Trail Swimrun FG Otillo Cool Mesh
197	Superga 2750 Efglu Herren White Gum Sneaker Mode - 9 UK
198	ELEMENT DONNELLY WALNUT PREMIUM HIKING BOOTS WANDERSCHUHE TREKKING STIEFEL
199	Art 661 Neon LUFTPOLSTER Turnschuhe Schuhe Sneaker Sportschuhe Damen
200	Rieker Damen Sneaker Lederimitat Laufsohle flexibel Lederinnensohle Schnürung
201	Porsche Design Adidas Herren Schuhe PDS Ultra Boost TRA EU 42 2/3 UK 8.5 US 9
202	New Balance ML574PR2 Herren Sneaker Grau Wildleder Freizeitschuhe
203	Adidas x Kanye West Yeezy Boost 350 V2 GLOW-IN-THE-DARK Schuhe Sneakers 42.5
204	Converse Chuck Taylor All Star Sneaker Schuhe CTAS Move Hi Obsidian 570261C
205	Art 652 Sneaker Schuhe Skater Schnürer Boots Neu Damen
206	Nike Air Max 270 Damenschuhe Neu Gr . 35,5 Special Edition ( AH6789-602 )
207	asics gel lyte III NS 41 42 42,5 43,5 44 44,5 47 H715N-0205 sAgA gT V H715N-0205
208	Adidas NEO Daily Team Herren Freizeitschuhe dunkelblau / orange Sneakers NEU
209	CATERPILLAR Apa Leder Sneaker Freizeitschuhe Turnschuhe Schuhe Herren Neuheit
210	Air Jordan 11 CMFT Low Herren Sneaker DO0613-007 Sport Basketball Schuhe Schwarz
211	Adidas Ventania Herren Laufschuhe Männer Running Sneaker Shoes FX7351 schwarz
212	Fila Schuhe Sommerschuhe Sneaker Ballerina Damen Lila Gr . 40
213	Skechers Sport Womens SUMMITS Sneakers Women Grau
214	Fila Sportschuhe 39 Neon orange Sommer guter Zustand Sneaker
215	asics Patriot 12 1011A823-415
216	KAMO-GUTSU SCHUHE GELB SNEAKER ART . TIFO 030 GIALLO COMBI ECHTLEDER ORGINAL
217	Schuhe Skechers Arch Fit - Big Appeal 149057-BBK - 9W
218	Art 415 Neon Turnschuhe Federsohle Schuhe Sneaker Sportschuhe Neu Herren
219	Damen Herren Sneakers Sportschuhe Freizeit Schuhe Schnürer 77202 Trendy Neu
220	SALOMON Supercross W V0 HERREN SPORT SCHUHE EU 42 RUNNING FITNESS GYM VIP TRAIL
221	Adidas Superstar black blue Sneaker Schuhe schwarz AQ8335
222	Damen Laufenschuhe Freizeit Sportschuhe Gemütlich Atmungsaktiv Running Sneaker
223	PUMA Smash v2 Buck Sneaker Freizeitschuhe Sportschuhe Lifesytle 365160
224	adidas Advantage Weiss Blau
225	Williot Herren Sneaker Kowalski Royal 111
226	Skechers Sneaker Low Go Walk Evolution Ultra Enhance - Charcoal / Hellblau Texti
227	Übergröße Herren Sneaker Turnschuhe Sportschuhe Klett 20481 Schwarz Dk . Grau
228	Neu adidas Strutter Herren Sneaker Sportschuhe Turnschuhe Freizeit FY8162
229	Nike Air Jordan 7 Miro OC EU41 US8 UK7 Olympic Barcelona DEADSTOCK !!! LIMITED !!!
230	Neu original Damenschuhe Fila Jagger wmn 1011103-1FG Sneaker Turnschuhe
231	New Balance 574 Herren Wildleder Blau Turnschuhe EU GraBe 40 - 47
232	FILA Sneaker , Woman , Farbe : Weiß / White , Size : EU :40 US :8.0 UK :6.5 , guter Zusta
233	2022 Jordan4 Purple Metallic Lässige Laufschuhe Basketball Turnschuhe CT8527-114
234	Puma Roma Mercedes Benz Amg Petronas Motorsport . Gr . EU44 - UK9 ,5 . NEU 1 . Wahl
235	Converse Chuck Taylor All Star Point Star OX Damen Schuhe Sneaker Turnschuhe
236	Nike SB Check Solarsoft Gr . 44,5 / US 10,5 / 28,5 cm Nike # 843895-003 black
237	Adidas Ultraboost DNA X Real Madrid Laufschuhe Sneaker Schuhe Blau Herren FZ3623
238	Nike Court Vision Low Herren Sneaker Braun CD5463-200 Sport Freizeit Schuhe NEU
239	Adidas NMD R1 Sneaker Herren Freizeitschuh Boost Triple Black FV9015
240	adidas Superstar Pure Herren Black White Sneaker Klassisch - 8 UK
241	Salomon X Scream GTX GoreTex Schuhe Outdoor Shohe Women Frauen Citytrail
242	Nike Air Jordan 4 Retro IV Premium EU 45 / US 11 / UK 10 alias PonyHair .
243	Nike Air Max 93 Watermelon 306551 105 UK_12 US_13 Eur 47.5
244	Damen Schuhe Sneaker Blau Low Turn Sportschuhe Ballerina Freizeitschuhe
245	New Balance Sportschuhe [ MRL247DM ]
246	adidas Daily 3.0 Herren Sneaker Turnschuhe Sportschuhe FW7439
247	Jack Wolfskin Wanderschuhe Force Striker Texapore low Trekkingschuhe Outdoor
248	Converse Chuck Taylor All Star Hi GTX Gore-Tex Unisex Sneaker 165941c
249	Nike Herren Sport Fitness Laufschuhe Odyssey React FLYKNIT Schuhe 44,5 / 28,5 cm
250	NIKE HERREN TURNSCHUHE FREIZEITSCHUHE SNEAKER ART . NIKE ROSHE ONE 511881
251	New Balance ML373WR2 Herren Sneaker Freizeitschuhe Sportschuhe
252	ONITSUKA TIGER Herren New York Joggingschuhe Sneaker WeiÃŸ
253	Vintage Adidas Marathon 80 UK 7.5 US 8.5 EU 41 1/3 Made in West Germany Bayer
254	Puma RSX trophy
255	Josef Seibel Sneaker Damen weiß Gr.36-44 SINA 65 Sportschuh
256	New Balance Classics ML 574 HX2 Herren Schuhe Grau-Weiß Freizeit Sport Schuhe
257	FILA Sneakers Damen Freizeitschuhe Turnschuhe Gr . DE 40 kein Etikett ... # 1b19aa5
258	Skechers Bobs Sportschuhe Damen Trainingsschuhe Sneaker Weiß Freizeit
259	Skechers Herren Bogen Passform - Banlin Schuhe IN Marineblau
260	Neu Fila Disruptor II Monomesh Türkis Schuhe Mehrfarbig
261	892845 Sportliche Damen Sneakers Low Freizeit Turnschuhe Schuhe Mode
262	adidas Yeezy 450 Cinder - EU 42 - 42 2/3 - 44 - NEU
263	Puma Leader VT Tech Herren Schuhe Sneaker Turnschuhe Freizeit 194531
264	Adidas S76368 ZX FLUX ADV ASYM PK Schuhe Freizeit Sneaker Sport Boots 47 49 Schw
265	Damen Schuhe Sneaker Weiß Silber Schwarz Plateau
266	DC Shoes Tonik Herren Sneaker | Turnschuh | Sportschuh | Leder - NEU
267	Giesswein Herren Schnuerschuhe Wool Cross X Men Gr . 43 Blau
268	Rieker Herren Sommer Schuhe Slipper Sneaker Gr . 44 Antistress braun und oliv
269	Damenschuhe Slipper Slip-On Sneaker Halbschuhe Schlupfschuhe Hellgrau 62982
270	Nike Air Force 1 Low '07 White Weiß NEU Sneaker Herren CW2288-111
271	MEINDL ® Sportschuhe Outdoor Manila Lady GTX ® Einzelpaar Preis ( M19 )
272	GEOX Sneaker Med Spherica A - Knitted Textil - Rot Textil Normal Damen
273	Converse Chuck Taylor All Star OX Damen-Sneaker Turnschuhe Halbschuhe Chucks
274	Levi ' s Herren Schuhe Schnürboots Herrenschuhe Boots High Top Sneakers Alpine
275	Onitsuka Tiger Serrano Damen Breeze White Schuhe Sneaker Rosa Blau Weiß
276	Adidas Springblade Solyce Laufschuhe Sneaker Turnschuhe Schuhe AQ5241 Gr . 40 NEU
277	Criss Cross Damen Sneaker Turnschuhe Halbschuhe Comfortschuhe Braun Gr . 39 ( UK6 )
278	Sportliche Damen Sneakers Low Turnschuhe Flats Schnürer 78509 Retro Schuhe
279	Rieker Herren Schnürschuhe Sneaker Sneakers Sportschuhe blau NEU
280	FILA Unisex Sportschuhe Laufschuhe Freizeitschuhe Sneaker Gr 41 Lila Orange Neon
281	New Balance ML574ET2
282	Lacoste Giron 116 1 SPM white Schuhe / Sneaker weiß
283	Fila Sneaker Sport Schuhe - weiß-Gr .40 Nr.T-01208
284	Nike Air Max Plus TN EUR GR .43 Multicolor Neue Herrenschuhe Turnschuhe 39-44
285	NEU Damen Herren Atmungsaktiv Sportschuhe Sneakers Turnschuhe Runners Schuhe
286	Neu SALAMANDER Avato Komfort-Halbschuhe 10265423 für Herren cognac
287	Asics Damen Nordic Walking Hiking Wander Trekking Schuhe Mission Q851Y Schwarz
288	SKECHERS Damen-Slipper Go Walk Joy Textil GoGa Mat Technologie
289	Damen Plateau Sneakers Sportschuhe 90 's Style 73105 Schuhe
290	REEBOK AZTEC OG black white scarlet red Q47273 NEU
291	NEU HERREN SCHUHE SNEAKER FREIZEITSCHUHE LAUFSCHUHE GR . 47-49
292	Art 341 Neon Turnschuhe Schuhe Sneaker Sportschuhe Neu UNISEX
293	NEU SKECHERS Damen Sneakers Walking Schuh Memory Foam GO WALK STARLIGHT Schwarz
294	Skechers Summits Herren Sneaker | Turnschuh | Sportschuh - NEU
295	Reebok Classic FURYLITE V69439 Größe 44,5 Farbe ECHO BLUE / BLACK / STEEL / WHT
296	Skechers Summits-Forton Herren Schuhe Sneaker Turnschuhe 52813 ( Schwarz-BKW )
297	Herren Damen Sneaker Sportschuhe Turnschuhe Klettverschluss Schwarz Grün 61185
298	ADIDAS ORIGINALS ZX 750 Herren Turnschuhe Königsblau UK Größen 7 Sich 12
299	ADIDAS Yeezy Boost 350 V2 Black Core Red Gr . 42 Brandneu mit Karton OVP Original
300	Skechers Men USA PARTON WILCON Sneakers Herren Schuhe Schwarz
301	Timberland Delphiville Damen Sneakers / Turnschuhe 37,5 Tb0a1y7j040 SilberGrau Neu
302	Asics Gel GT-2000 7 Damen Lauf.-Joggingschuhe Running Sport , 1012A147-400 / N2
303	Frauen Laufschuhe Sneaker Mode Casual Turnschuhe Running Rutschfest Sportschuhe
304	Dockers by Gerli Herren Sneakers Halbschuhe Freizeitschuhe sportliche Halbschuhe
305	Converse Chuck STAR PLAYER LEATHER OX Größe 40 Black Fatigue Green Red Block
306	adidas Predator Mutator 20.1 Low SG Fußballschuhe Rasen Premium ( EG1603 ) NEU
307	Skechers Sport Herren ARCH FIT Sneakers Men Beige
308	Nike Schuhe Herren 42,5
309	asics Gel Quantum 360 6 1021A471-020
310	adidas Skyline Mid Star Wars Coruscant Sneaker Schuhe G41818
311	Jordan 4 Retro Travis Scott Cactus Jack - 308497-406 - US9 .5 / EU43 Deadstock
312	On Running Cloud 19.0000 Black White Men Sneaker Turnschuhe Herrenschuhe Sport
313	Timberland Ballard Gr 41 US 9,5 mit 2 cm integriertem Absatz Damen Schuhe 8336R
314	Reebok Workout Suede Trainers V69720 Teal / Gum Sole UK7 / US8 / EU40 .5
315	Nike Air Max 270 Herren Sneaker Weiß DD7120-100 Sport Freizeit Schuhe Turnschuhe
316	Adidas Originals JEANS Turnschuhe Neu Farbe Herren UK Größen
317	adidas spezial königsblau grün UK 11
318	Adidas ZX 8000 National Park Foundation Yellowstone FY5168
319	NEU SCHUHE PUMA RESPIN SL SNEAKER SCHUHE Herrenschuhe
320	Ecco Schuhe MX schwarz Herrenschuhe sportliche Halbschuhe 82018402001 NEU
321	Nike Air Jordan 1 Retro High Pollen Sneaker 555088-701 NEU Herren Damen Schuhe
322	Neon Turnschuhe Schuhe Sneaker Boots Sportschuhe Herren 096
323	CONVERSE CHUCKS ALL STAR CTAS 70 HI EU 46.5 UK 12 schwarz blitze Fell 163788C
324	Ash Platform Sneaker 38 Schwarz
325	Puma Schuhe Axelion Rip Outdoor Laufschuhe Fitnessschuhe SoftFoam + Sohle Herren
326	Globe Sabre Skateschuh Herren schwarz / blau
327	Puma TARRENZ SB Outdoorschuhe Hohe Sneaker 370551 Schwarz
328	NIKE Air Footscape NM 41 42 43 44 45 46 852629 500 huarache rift presto chukka
329	Adidas Runfalcon Herren Schuhe Sneaker Turnschuhe Freizeitschuhe Sportschuhe
330	Adidas STRUTTER Herren Schwarz Echtleder Sneaker Sportschuhe Sneaker EG2656
331	Skechers Flex Appeal 3.0 Fan Craze Damen Sneaker Grau 149008-GYMT Sport Schuhe
332	ADIDAS ORIGINALS GAZELLE SNEAKERS POWER RED / WHITE / GOLD METALLIC BB5486
333	Damen Sneaker Wedges Keilabsatz Glitzer Turnschuhe Schnürer 822788 Schuhe
334	Kastinger Trailrunner Damen Herren Wanderschuh in Schwarz / Lime
335	PUMA RS-Z Outline Sneakers Unisex Schuhe Neu
336	Birkenstock Linz ESD Herren Arbeitsschuhe | Sicherheitsschuh | Naturleder - NEU
337	Ecco BIOM Fjuel Herren Sneaker 857534-11543
338	NEU HERREN SPORTSCHUHE LAUFSCHUHE FREIZEITSCHUHE SNEAKER GR . 41-46
339	AIR JORDAN 1 RETRO HIGH DMP " BULLS CELTICS PACK " RELEASE 2009
340	Herren Damen Turnschuhe weiße Sneaker Sportlaufschuhe Outdoorschuhe MQ NEU DE
341	adidas Originals Stan Smith Sneaker Gold Metallic FW5364 Freizeit Schuhe NEU
342	Converse Chuck Taylor All Star Hi Herren-Lederschuhe Sneaker Hi-Top Schuhe
343	Adidas Crazy Chaos Herren Cloudfoam Turnschuhe UK 9 US 9.5 Eu 43.5 Ref .2568 cm
344	asics Gel Luminus 3 Herren Men Laufschuhe Running Sample Gr . 42,5 US 9
345	NEW BALANCE 990 HERRENSNEAKER MADE IN USA GR :43 NEU !!!
346	Globe Dover II Black / Wasted Talent
347	Buffalo Herren Schuhe Sneaker 5050-12833 Oil Nubuck Lea Grey 01 grau
348	Unisex Alles Schwarz 2022Vans Old Skool Sneaker Skate viele Farben Gr.35-45
349	NIKE FREE 5.0 Damen Sport Schuhe Laufschuhe Fitness Jogging Gr .38
350	Sport Tanzschuhe Damen Athletik Turnschuhe Outdoor Atmungsaktiv Sneaker 34-41 B
351	Converse Chuck All Star Player OX Größe 45 Natural Navy White Model 156620C Neu
352	Adidas VL Court 2.0 Sneaker Sportschuh Leder blau Gr 45 1/3 ( Neu & OVP ) FV4364
