Record Number	Title
3513	ADIDAS ULTRA 4D PACKER " DEEP BLUE " FY4363 new in box US 13 UK 12,5 EUR 48 J 310
3514	Skechers SUMMITS Damen Fitnessschuhe Sneaker Memory Foam Schwarz
3515	KEEN Schnürschuh Ridge Flex WP 1024916 black / magnet ( schwarz ) NEU
3516	MERRELL Alverstone Wanderschuhe Outdoorschuhe Trekkingschuhe Turnschuhe Herren
3517	Nike Air Max 200 SE Herren Sneaker Weiß CJ0575-101 Sport Freizeit Schuhe NEU
3518	Skechers Sneaker Med Go Run Consistent - Schwarz / Grau Synthetik / Leder Normal H
3519	DAMEN SCHUHE SNEAKERS HOKA ONE ONE WS CLIFTON EDGE [ 1110511 EBWH ]
3520	FILA Disruptor CB Low Leder Sneaker Damen Freizeit Schuhe Plateau Turnschuhe NEU
3521	Merrell Intercept Herren Trekking & Freizeit Schuhe J73703 Leder Wanderschuh NEU
3522	Vans Slipper Gr . 44.5 US 11 UK 10 Slip On schwarz black Sneaker Checkerboard
3523	Skechers Sport Mens FLEX ADVANTAGE 4.0 WOODLAND Sneaker 232237 / TPE beige
3524	0 ' Neill , Herrenschuhe-Sneakers , SportschuheSONDERPREIS ; Gr : 39 + 40 + 45
3525	Adidas Stan Smith Herren Leder Schwarz Schuren Turnschuhe EU GroBe 40 - 47
3526	adidas Run 70s Herren Sneaker Schwarz EE9758 Freizeit Sport Fitness Schuhe NEU
3527	Reebok Instapump Fury Damen Sneaker Freizeit Sportschuhe Trainingschuhe BD1506
3528	Asics Herren Jolt 3 Turnschuhe Laufschuhe Sneaker Blau Sport
3529	Adidas Galaxy 3 W trainer Schuhe Sport Laufschuhe Sportschuhe Gr . 44 45 Neu
3530	Lacoste Herren Straightset Thermo 03211 Schwarz 742CMA000502H Winter Schuhe Neu
3531	adidas Sport Inspired Grand Court Sneaker Mesh Tennis Herren Weiß F36985 SALE
3532	Geox U Ravex B Sneaker Freizeit atmungsaktiv Leder Turnschuhe Antracite
3533	Nike Vapormax Plus CW7478-001 Black / Volt / Pistachio / Frost Size 1
3534	!!! COLLECTORS ONLY !!! Nike Air Max Triax Series Rot , red , 40 , damaged , very rare
3535	Skechers Herren Sneaker dunkelrot mit Memorysohle Artikel 52504 BURG
3536	Herren Damen Sneaker Outdoorschuhe Trekkingschuhe Wanderschuhe 145435
3537	NIKE Air Max SPAN TXT FB Neu Gr :43 US :10 90 95 97 Skyline Command Sneaker New
3538	Asics Tiger Gel Lyte III White White 1191A251-100 Sneaker Shoes Schuhe Men
3539	Damen Plateau Sneaker Schnürer Keilabsatz Glitzer Schuhe 836363 Trendy Neu
3540	Fila Schuhe 38,5 39 1/2 Sneaker blau dunkelblau classic disruptor unisex
3541	K-SWISS Herren Schuhe schwarz HOKE Leder Sneaker Sportschuhe 39 41 42 44 45 47
3542	Air Jordan 1 High Royal Blue
3543	Jordan 1 Low Black White Grey ( GS ) | 553560-040 | Neu | OVP | viele Größen
3544	Rieker Antistress Damen Sneaker Freizeitschuhe Slipper Comfort Blau Gr . 42
3545	Adidas Indoor Super Herren Sneaker Turnschuhe Schuhe Leder BY9769 blau Gr . 40
3546	Damen Sneaker Schuhe Turnschuhe Freizeitschuhe Nieten
3547	Nike Air Zoom Pegasus 36 Shield ( AQ8005 001 ) All Black Sneakers Mens NEU OVP
3548	Damen Sportschuhe Laufschuhe Prints Turnschuhe Schnürer Sneaker 826163 Schuhe
3549	Nike Air Max 1 ID Gr .45 schwarz CN9671 991 Sneaker Herren Sport Classic Neu
3550	Nike Dunk Low Lime Ice ( W ) - EU Größen 37.5-38 - Blitzversand -
3551	UNCLE SAM Herren Leichtlaufschuhe Sportschuhe Sneaker Joggingschuhe Kreis-Logo
3552	C7934 sneaker donna HOGAN CLUB H222 NUOVO SPORTIVO XL nero borchie shoes woman
3553	Diesel PASS ON Herren Sneaker Schuhe Turn Chucks Low Leder Neu shoes Wählbar
3554	Herren Sneaker P448 E7 Star 2.0 Army 40 41 42 43 44 45 46 NEU
3555	Skechers Go run 400 Action 14351 Schwarz BBK Sneaker Soft Laufschuhe
3556	Nike air force grösse 43 weiss / rot 1 mal getragen . Leichte Gebrauchsspuren
3557	Neu adidas Laufschuhe Ultra Boost 19 Schwarz Bunt Herren Ultraboost G54011
3558	CAT CATERPILLAR Instruct P722309 Leder Sneaker Freizeit Turnschuhe Schuhe Herren
3559	DIESEL BLACK GOLD FW16-FS2 I00478 PR013 T1003 Designer Damen Sneaker Schuhe
3560	Baabuk Sky Wooler Sneaker Merino Schurwolle Wolle Navy Brown Eco Fashion
3561	Pepe Jeans Damen Sneaker Beatty Padding PLS30043 Black
3562	Schuhe Sneaker Freizeitschuhe Tamaris Gr .39 Leder TOP
3563	ASICS Laufschuhe Gel-Lyte III Größe 8 US Herren Spectra Grün Neu mit Box
3564	Asics Gel-Lyte V Sky Blue Leather Lace Up Casual Mens Trainers HL7K1 3939 Z11A
3565	Fila Town Classic Damen Sneaker low Glattleder weich gepolstert rutschhemmend
3566	893658 Damen Sneakers Kult Sportschuhe Stoffschuhe Schnürer Gr . 36-41 New Look
3567	NIKE AIR FORCE 1 LV8 VT Red Independence Day Gr .42,43,44,45 NEU & OVP Jordan
3568	Nike SB mns Sneaker Low Stefan Janoski Max - black - Neu & OVP
3569	LOWA Sneakers Damen Freizeitschuhe Turnschuhe Gr . DE 34 kein Etikett ... #cc 18f92
3570	asics Japan S 42,5 45 46 47 1191a212 101 Vegan mExiCo 66 tiger gsm aaron
3571	PUMA Rebound Joy Mid Herren Sneaker high gepolstert Lederimitat Gummisohle bunt
3572	SAUCONY Damen Sneaker Schuhe Jazz Original S2044-449 schwarz weiß
3573	Puma BMW MS Future Cat M1 2 Weiß Herren Sneaker Freizeitschuhe Casual Turnschuhe
3574	Adidas ZX 8000 A-ZX Atmos G-SNK FX 8593 Gr 45 1/3 US 10,5 UK 10 neu und ovp
3575	Damen Plateau Schnürschuhe Shape Ups Tönend Fitness Wandern Sport Turnschuhe Neu
3576	Damen Sneaker Wedges Schnürer Keilabsatz Strick Schuhe 838363 Trendy Neu
3577	Nike Air Max Tavas Herren Sportschuhe Sneaker EUR 42 Nr . 21-Y-2505
3578	Josef Seibel Felix 01 Herren Sneaker , Obermaterial Leder , Wechselfußbett
3579	Asics Gel Kayano 28 Schwarz Herren Laufschuhe Run Sport Sneakers 1011B189-003
3580	Nike Waffle Racer Herren Sneaker Turnschuhe Schnürschuhe Komfort Braun Gr . 46
3581	CONVERSE Chuck Taylor All Star Dainty Sneaker Schuhe Damen Original Alle Größen
3582	Asics Gel Lyte 3 Sean Wotherspoon x atmos US 6 EU 39
3583	adidas Samba OG Schuh B75681 Weiss Turnschuhe Unisex Sportschuh Retro Klassiker
3584	Colors of California Damen Sneaker Chucks Grün mit Nieten
3585	Nike Dunk By You Deadstock Herren Schuhe 1 of 1
3586	Art 482 Turnschuhe Schuhe Sneaker Sportschuhe Luftpolstersohle Herren
3587	New Balance ML574EGG Classic Herren Sneaker Sportschuhe NEU
3588	Herren Laufschuhe Schnürer Sneaker Turnschuhe Dämpfung Zwischensohlen 46 47 48 B
3589	Prada Original Sneaker Schuhe 7,5 Herrenschuhe 41 Wildleder Beige Velour * K
3590	asics Gel - Kayano 27 1011A767-020
3591	DOLOMIT DOL Diagonal Lite Shoe Wanderschuhe Freizeitschuhe Walkingschuhe
3592	Adidas NMD_R1 STLT PK Primeknit / Stealth Pack / Boost / schwarz / grau / pink / weiß / CQ2386
3593	Adidas Stan Smith Lea Sock white green Sneaker weiß AQ4787
3594	Nike TN Air Max Plus Hyper Royal Volt
3595	Nike Air Max 270 grockt für Sammler - Black - DD7120-001
3596	NEU Converse All Star Gemma Hi W 41 Chuck Taylor Sneaker Chucks Schuhe 554431C
3597	NIKE Air Max 2090 weiß schwarz grün CV8835 100 Sneaker
3598	adidas Terrex Free Hiker Parley Sneaker Wanderschuhe Schwarz Schuhe EF0347
3599	Asics Patriot 12 W 1012A705-001 schwarz
3600	Boots & Braces Sneaker Vegetarian And Vegane Schuhe Turnschuh Vegi Black Noir
3601	Columbia Redmond III Wasserdichte Sneaker Wanderschuhe Turnschuhe Schuhe Herren
3602	Crocs Classic All Terrain Clog Roomy Fit Unisex Sandale Hausschuh 206340 Grau
3603	Art 228 Neon Turnschuhe Schuhe Sneaker Sportschuhe LUFTPOLSTER Neu Herren
3604	Nike Dunk low pro / Grey Fog US 11 EU 45
3605	MERRELL Agility Peak Taktische Armeeschuhe Kampfschuhe Schuhe Herren Neuheit
3606	Nike Vapormax ' Be true ' Schuh Größe 40 - SELTEN - SEHR GUTER ZUSTAND
3607	Skechers Damen Sneaker Sneakers Sportschuhe Schnürschuhe weiß 117006 NEU !
3608	MERRELL Agility Peak J17742 Taktische Armeeschuhe Kampfschuhe Schuhe Damen Neu
3609	Herren ASICS Laufschuhe Gel-Lyte III Größe 9.5 US Rot Neu mit Box
3610	Herrenschuhe Sportschuhe Turnschuhe Freizeitschuhe Laufschuhe Running Sneaker
3611	Damen Plateau Sneaker Warm Gefütterte Turnschuhe Winter 831638 Trendy Neu
3612	FILA Ray Tracer Athletic Schuhe Weiß Marineblau Rot Neu Herren
3613	adidas Handball Spezial FX5676
3614	Nike Air Jordan 1 Mid Reverse Bred ( GS ) | 554725-660 | New with Box ✔
3615	Adidas Tubular Invader STRAP BB8394 Camouflage Neu Gr :46 2/3 Sneaker Originals
3616	Graceland Damen Sneaker Gr . 39 Bronzefarben
3617	Nike Revolution 5 ( GS ) Kinder Damen Sneaker Laufschuhe BQ5671 504 Gr . 40
3618	adidas x Neighborhood NBHD Gazelle Super DA8836 Sneaker Schuhe Turnschuhe NEU
3619	Damen Plateau Sneaker Schnürer Keilabsatz Profil-Sohle 838303 Schuhe
3620	Lacoste Evershot CRE SPM black Schuhe / Sneaker schwarz Größenauswahl !
3621	Legero Sneaker Tanaro Indaco blau Halbschuh Nubuk Leder Schnür 00820 86
3622	Lands ´ End Sneakers Damen Freizeitschuhe Turnschuhe Gr . DE 37.5 Kunst ... # 71daba1
3623	adidas SL20 .2 M Running ( FW9156 ) Schwarz Grau Mens Sneaker Trainers - NEU OVP
3624	NEU SKECHERS Damen Sneakers Turnschuhe Slipper BOBS PLUSH - FESTIVAL STAR Grau
3625	KAPPA Damen Sneaker Schuhe weiß Lacklederimitat Plateau Gr 39 40 42 NEU M228
3626	Asics Onitsuka Tiger Mexico 66 smoke light blue Sneaker
3627	Adidas Calneo Stripe Mid Damen Schuhe Shoe Sneaker Sport Turn Chucks Wählbar
3628	NIKE Herren LAUFSCHUH " Mens Revolution 5 " black / white
3629	Fila 1010834 1FG Dynamico low wmn Damen Sneaker Weiss
3630	Grüne Nike Schuhe kaum getragen .
3631	Adidas Stan SMITH Junior Damen Neu M20604 Black Gr :36 Retro sneaker samba
3632	adidas Entrap Mid Herren Sneaker Turnschuhe Sportschuhe FY6621
3633	Fila Sandblast Low WMNS ( 1011035.25 Y )
3634	Gola Boston 78 Snake Damen Navy Sage Sneaker Mode - 37 EU
3635	New Balance MSX 90 D TTI Grey Blue Schuhe Sneaker Grau Blau
3636	Moschino Sneaker Gr 37
3637	Puma R 78 SL Herren Sneaker Lederimitat Textilfutter Retro-Running-Laufsohle
3638	Herren Laufschuhe Elastische Schuhe Sneakers Leichte Outdoor-Schuhe Gr.35-48
3639	Converse Chuck Taylor All Star Unisex Sneaker Schuhe CTAS Hi Black Honey 168826C
3640	Puma Ignite Flash evoKNIT SR Joggingschuhe Damen Fitnessschuhe 192457 02
3641	Original BMW M Motorsport Schuhe PUMA Roma NEU
3642	WOW NIKE AIR JORDAN 6 RETRO BLACK VARSITY RED 2010 MJ RARE NEU NEW US 10 EU 44
3643	ASICS Damen Gel Quantum 360 CM Laufschuhe Größe 9.5 US
3644	New Balance ML373 Herren Sneaker Freizeitschuhe Multicolor
3645	Puma Carson 2x Knit Wn ' s Damen Sportschuhe Turnschuhe Laufschuhe Sneaker NEU
3646	Damen Herren Turnschuhe Sportschuhe Laufschuhe Fitness Freizeitschuhe Sneaker
3647	Asics BIKU CV braun Herren Canvas Sneaker Schuhe 37 38 39 40 41 42 43 44 45 46
3648	Adidas Campus Originals Samba Spezial Gazelle ZX Neu Gr :38 2/3 BZ0069 Pink Suede
3649	Nike Air Max 97 Herren Sneaker Sportschuhe Turnschuhe Grau 312834-004
3650	Reebok ROYAL GLIDE V53955 Herren Schuhe Sneaker Freizeitschuhe Weiß Echtleder
3651	Tommy Hilfiger Lace-up-Sneaker Schuhe Herren Weiß FM0FM00596100
3652	Puma Clyde X Undefeated 44.5 Micro-Dot Steel Grey
3653	Bugatti Herren Sneaker in oliv grün leichter Freizeitschuh Turnschuh
3654	Nike Air Jordan 1 Low Shadow Toe EU 43 / US 9.5 NEU & OVP
3655	Sneakers Boots SKULL Gothic Totenkopf Schuhe gefüttert 36 37 38 39 40 41 NEU
3656	Gabor Comfort Damen Sneaker Gr .6 Weite G mit Wechselfußbett Farbe Weiß neu
3657	Nike Air Jordan 1 Low Dark Beetroot Roma Green ( GS ) | NEU & UNGETRAGEN ✅
3658	Converse Herren Unisex Chucks Sneaker Boots 70 Hi natur Gr .41
3659	Top Herren Sneakers Sportschuhe Stoffschuhe Schnürer 85553 Mode
3660	Skechers Men USA RELMENT TRAVEN Stiefel Herren Braun
3661	ASICS GEL PTG Point Getter Freizeit Mode Outdoor Sneaker H8H0L-2121 braun neu
3662	Neu SKECHERS Skech-air Edge Brite Times Slip-On-Sneaker 13328912 für Damen
3663	PUMA SUEDE MID ZEBRA DAMEN SNEAKER MADE IN JAPAN UK 7 40.5 fenty rihanna creeper
3664	Damen Gesundheitsschuhe Sneaker Spezial Rundsohle Aktivschuhe Gesundheit 0042
3665	Gabor Rollingsoft Damen Schuhe Sneaker Laufschuhe Schnürschuhe Gr 37,5 Leder
3666	Nike W Roshe TWO Flyknit 365 Damen Women [ 830751 400 ] NEU Größe wählen
3667	Skechers Sport Womens SUMMITS NEW WORLD Sneakers Women Schwarz
3668	Lakai Footwear Skate Schuhe Shoes Porter Midnight Canvas 8,5 / 42
3669	Fila trigate Black White 42 Sneaker , Schuhe , Turnschuhe neu ungetragen
3670	ASICS FUZEX RUSH MIDGREY / BLACK / WHITE DAMEN LAUFSCHUHE UK 5 - 8 EU 38 - 42
3671	Timberland Damen Bootschuhe Schnürschuhe Heritage Noreen Freizeitschuhe Sneaker
3672	crocs Sneaker Low Literide Pacer Men Schwarz / Schwarz Croslite Normal Herren
3673	ORIGINAL ADIDAS ZX 700 HD G55780 HERREN TURNSCHUHE SNEAKER FITNESS SPORT SCHWARZ
3674	Vamos Damenschuhe Sneaker Slipper Active Sportschuhe Grau Weite H-Viele Größen
3675	Geox U Snake Y Sneaker Freizeit atmungsaktiv Leder
3676	Damen Freizeitschuhe Footflexx Komfortschuhe Sneaker G-Weite Gr .36 38 39 40 NEU
3677	nike air force 1 pink
3678	Adidas ZX 2K Boost Gr . wählbar FZ3322 742L Laufschuhe Sneakers Turnschuhe
3679	Converse Chuck Taylor All Star Low Schuhe Sneaker Turnschuhe 564115C ( Orange )
3680	adidas Originals Yung Schuh Grey Grau F35018 Turnschuhe reduziert NEU SALE
3681	Herren Freizeitschuhe Atmungsaktives Laufschuhe Tenis Masculino Schuhe Gr.39-45
3682	Neu Limitierte Auflage Herren FILA MINDBLOWER Weiß Blau Rot Schnürer Run Sneaker
3683	Nike W Air Jordan 1 Zoom CMFT Bred CT0979 006
3684	adidas Originals VRX CUP MID Herren Sneaker B41479 Schuhe Skaterschuhe Schwarz
3685	adidas Gazelle og multicolor M19657 originals camo sneakers
3686	adidas Adizero Takumi Sen 7 Laufschuh Gelb ( FW9152 ) Sneakers Trainers NEU OVP
3687	EMILIO PUCCI CITY UP RUFFLE TRAINERS SLIP-ON SNEAKERS SHOES TURNSCHUHE SCHUHE 39
3688	Damen Herren Sneaker Freizeit Sommer Schuhe Slipper Clog Sabot Pantoletten 49379
3689	893175 Damen Sportschuhe Runners Lederoptik Sneakers Laufschuhe Mode
3690	asics gel gt-II 41,5 43 44 45,5 47 saga lyte III atmos vintage runner 80 's
3691	Adidas ZX 8000 A-ZX Atmos G-SNK FX 8593 Gr 45 1/3 US 11 UK 10,5 neu und ovp
3692	Replay Gream RZ710008L Herren Sneaker Herren Stiefel Herren Schuhe sale 28071910
3693	Nike Air Jordan 1 Mid Sonics | Verschiedene Größen ✅
3694	Floris van Bommel Sneaker Nineti gelb und orange 16392
3695	Herren Running Sneaker Sportschuhe Freizeit Mode Atmungsaktiv Laufschuhe Joggen
3696	New Balance 550 White Navy Blue Sneaker BB550WA1 NEU Herrenschuhe
3697	New Balance 1550v2 Trainers ML1550NE Black Caviar / White UK11 / US11 .5 / EU45 .5
3698	MEINDL Caracas GTX Herren Wanderschuh Outdoorschuh Schnürschuh Schuh Leder brau
3699	F0702 sneaker donna black / brown CAMPER PELOTAS MISTOL scarpe shoe woman
3700	Modische Damen Pailletten Sneakers Low Lack Turnschuhe 815953 Schuhe
3701	Asics Gel-Lyte III bay / white Schuhe Sneaker Runner türkis mint H7F9N 8701
3702	ETNIES JP WALKER WAYSYER SNEAKER NEU BLACK GR : US 10,5 EUR 44 ETNIES
3703	Sportliche Herren Damen Sneakers Low Turnschuhe Canvas Schuhe 79861 Trendy Neu
3704	Herren Atmungsaktiv Wanderschuhe Herrenschuhe Komfortabel Freizeit Sport Sneaker
3705	Candice Cooper Schuhe Sneaker Lucia Damen Gr . 38
3706	Adidas Originals NY 90 Stripes H04429 Sneaker Sportschuhe Herrenschuhe NEU
3707	Skechers Dynamight Herren Sneaker Schuhe Turnschuhe 58360 ( Schwarz-BKW )
3708	adidas James Harden Vol . 1 Boost Herren Basketballschuhe AH2120 Sport Schuhe NEU
3709	Nike Air Jordan 1 Retro High OG Obsidian Size 7 EU 40 New
3710	New Balance 373 Lifestyle Sneaker Schuhe Herren Dunkelgrün ML373CB2
3711	Herren Schuhe Freizeitschuhe Running Sneaker Sportschuhe Laufschuhe Turnschuhe
3712	Damen Sportschuhe Sneaker Plateauschuhe Freizeitschuhe Boots 124
3713	Fila Turnschuhe - Sneaker Gr . 39 Kunstleder schwarz . Damen
3714	Art 360 Sneaker Turnschuhe Schuhe Sportschuhe Slipper Laufschuhe
3715	Nike Air Huarache weiß / weiß / platinTriple White weiss 47,5 47.5 13
3716	Converse CTAS Stingray metallic Ox 553347C Damen Leder GR.35-41 ,5
3717	CONVERSE Seek PEACE Edition CHUCK TAYLOR ALL STAR HI Weiß 167892c
3718	Weiß ASG14 Oxford Obsolete Pakistaner Qualität Leinenturnschuhe Pumps Schnürer
3719	NEU Converse All Star Modern Hi 45 Chuck Taylor Leder Sneaker Chucks 156587C
3720	WMNS Nike Shox TL Nova Gr . wählbar Neu & OVP AT8046 003
3721	Remonte Damen Sneaker R7982-02
3722	KAMO GUTSU Schnürer Leder-Sneaker - Gel Ice Curcuma - Made in Italy - Neu ! Gr . 44
3723	Superga Shoes Sneakers Man Woman 2555-ALPINA JELLYGUM COTU Leisure Low Cut
3724	GRANDPRIX ORIGINALS Racing Sneaker black-orange Gr .40 reg.Vk-Preis 179 , - €
3725	Adidas NY 90 J FY9841 Damenschuhe Sneaker Turnschuhe Freizeitschuhe Schuhe Neu
3726	Puma Graviton Unisex Sneaker Sportschuh 380738 Weiß
3727	Nike Air Max 95 LX Platin / Weiß Gr . 44 pure platinum / white AA1103 005
3728	Damen Sneaker FILA Gr .36
3729	Adidas UltraBoost 4D 5.0 Black Carbon Anthracite Größe 44 2/3 G58160 Ultra Boost
3730	Nike Air Safari QS 2018 US 11 EUR 45 Atmos Dunk Sb Air Max
3731	NEU SKECHERS Damen Sneakers Bungee Memory Foam BREATHE-EASY SPECTACULAR Schwarz
3732	Converse C Taylor A / S Hi Chuck Schuhe Black 13521C unisex schwarz Leder
3733	Original NIKE Revolution 3.0 Gr . 47,5 / US 13 / 31 cm - Nike # 819300-012 black
3734	Keds Champion CVO , Damen Sneakers , Grau ( Grey / 80 ) , 38 EU , UK 5
3735	WMNS Nike Air Max 270 React Gr . wählbar Neu & OVP AT6174 100
3736	Nike Air Max 90 Herren Sneaker Grau DJ6881-002 Sport Freizeit Schuhe Turnschuhe
3737	adidas Edition Materials of the World Japan 1 OF 200 Vintage Gr . 46 ( UK11 )
3738	JORDAN Zoom Trunner Ultimate Herren Sneaker Grün CJ1495-300 Running Schuhe NEU
3739	Damen Stretch Bequeme Sneaker Laufschuhe Freizeitschuhe Atmungsaktiv rutschfest
3740	Damen Laufschuhe Strick Sportschuhe Fitness Sneaker Schnürer 832680 Trendy Neu
3741	Asics Gel-Pulse 13 GTX Herren Laufschuhe Turnschuhe Sneaker Sport 1011B178-001
3742	Candice Cooper Damenschuhe Größe 40 Braun Sneaker HOCHCHEVIGNON
3743	adidas Terrex Swift R2 GTX CM7492
3744	New Balance Herren-Sneaker Low ML 574 AB2 Sport-Schuhe Turnschuhe Freizeit Blau
3745	Nike Air Max Infinity Herren Schuhe CU9451-001 Sneaker Sport Laufen Wandern 45
3746	Adidas Porsche Design Easy Summer Drive Sneaker Schuhe Limited 46 2/3 Uk11 1/2
3747	Puma Rebound LayUp SD Fur Herren Sneaker Mid Cut Gefüttert ( 369831 01 )
3748	Lloyd Sneaker Agon schwarz Leder Gummisohle Schnür Halbschuh 28-505-10
3749	On Herren Sneaker CLOUD - Swiss Ing Run Trainers Schuhe Sneakers Gr . 43 ( UK 9 )
3750	Adidas Equipment Support 93 Nuude Weiß Gr . 42 UK 8 NEU & OVP S76702
3751	Nike Air Max 270 React Damen Sneaker Turnschuhe Sportschuhe CZ0374-500 , Neu
3752	adidas Advantage Classic Weiss Rot
3753	Candice Cooper Sneaker , hightop , bunt , Leder & Stoff , Damen , Gr . 38
3754	Herren Trekkingschuhe Sportschuhe Wanderschuhe Laufschuhe Runners 2114 Schuhe
3755	ON Running Cloud 5 Waterproof Schwarz 59.98842 Herren Sport Schuhe Laufschuh NEU
3756	Neu Mädchen Jungen LED Sport Roller Heelys Schuhe Farbwechsel Sneaker Schuhe
3757	Original Puma Sneaker Turnschuhe Play Nude White 44 Top Chucks Men Männer Box
3758	AND1 mid top Sneakers / Skaterschuhe Glattleder , gebraucht , 42 rot gelb
3759	ASICS GEL-LYTE ™ V Good Fortune
3760	Puma Comet 2 Alt Herren Sneaker Turnschuhe Freizeit Sport 194272 02 Gr . 44.5
3761	NEU SKECHERS Herren Sneakers Hiking Schuh SELMEN REVANO Grau
3762	ASICS Gel Lyte 5 / V 44 " Laser Cut " Pack Black / Black
3763	ASICS Damen Gel Nimbus 21 Meisten Mattiert Mandel Größe 11 US
3764	Damen FILA Original Laufen Primavera Weiß Neon Pink Grob 41 Sneakers
3765	Puma El Rey Future black / black Schuhe schwarz
3766	Nike Air Jordan 1 Mid Armory NAVY / BLACK-WHITE 42 Ausverkauft
3767	Schuhe von Lacoste Sneaker Leder schwarz Herren Größe 10 / 44,5
3768	SAUCONY " PEREGRINE 11 GORE-TEX " DAMEN SCHUHE LAUFSCHUHE SCHWARZ GR . 41 NEU
3769	adidas Continental 80 gr 42,5 43 44 45 46 BD7645 sTaN sMiTh rOd LaveR LeNdl
3770	Ecco Halbschuh EXOSTRIDE Hellgrün Pu Nappa Mesh Sneaker 835323 51732 Gummizug
3771	Nike Jordan Max Aura AQ9084-106 white Sneaker Herren retro Gr .42,43,44,45,46
3772	Puma Unisex Schuhe Sneaker Turnschuhe Kreta 350081 03 braun
3773	Puma Disperse XT 193728-03 Herren Sneaker Fitness Schuhe Weiß Schwarz Blau SALE
3774	Adidas Originals EQT Equipment Support Ultra Sneaker Schuhe BB1240 NEU 40,5 & 41
3775	adidas Performance Grand Court Base Beyond Sneaker Herren NEU Schuhe Turnschuhe
3776	Adidas Ultra Boost 4D Parley EU 46
3777	New Balance ML 574 EGN Herren Blue Black Iris Schuhe Sneaker Navy Blau
3778	Art 881 Sneaker Turnschuhe Schuhe Sportschuhe Neu Damen Herren
3779	Schuhe NIKE AIR MAX 270 GS Damenschuhe Jungen EXCLUSIVE Sneaker Turnschuhe TOP
3780	Nike Air Jordan 1 Mid Light Smoke Grey Anthracite NEU DS EUR 43
3781	Lacoste Bayliss Deck 0721 Herren Sneaker Blau 7-41CMA0062092 Mokassin Schuhe NEU
3782	Art 714 Neon Luftpolster Turnschuhe Schuhe Sneaker Sportschuhe Neu Herren
3783	Etnies Scout Shoes charcoal heather Herren Sneaker NEU
3784	NOS 90er ASICS GEL Sneakers US 5 True Vintage Saga Fashion Hipster Normcore 90s
3785	asics gel lyte 3 Hanon X Wild Cats Orange Red US 11,5 mit Original Beutel
3786	Keen Damen Ridge Flex Wasserdicht Waking Schuhe Braun Sport Outdoor Wandern
3787	PLATINUM Herren Leichtlaufschuhe , Sportschuhe , Freizeit , Turnschuhe , Blau / Multi
3788	Puma Sneaker INTERFLEX Runner Damenschuhe Übergrößen Schwarz
3789	ASICS Damen Gel Quantum 180 4 Schwarz Weiß Laufschuhe Größe 9 US
3790	Y-3 Yamamoto NEW BBALL Schuhe 5,5 38,5
3791	Reebok Gr 37,5 gern getragen Sammler # 26
3792	Puma Rebound LayUp Mid SL Unisex Schuhe Sneaker Mid Cut 369573
3793	Herrenschuhe Running Sneaker Schnür Sportschuhe Turnschuhe Laufschuhe DE SIZE
3794	Fila DISRUPTOR II Damen Sportschuhe [ 079 125 ] Neu
3795	New Balance WR996LCC 622952-50 3 Damen Sneaker Schuhe blau
3796	Timberland Formentor 43 43,5 44 44,5 45 45,5 Boot Segelschuhe VENT P2I 97155
3797	Adidas Lite Racer 2.0 EG3283 Herren Sportschuhe Sneaker
3798	adidas SOLAR BOOST ST 19 Men | G28060 Herren Laufschuhe und Trendschuh
3799	New Balance WL574SM2 beige / lila , Damen Sneaker , NEU im Karton
3800	KangaROOS RC-Pledge Herren Sneaker Low Schnürschuh Freizeitschuh Halbschuh
3801	Rieker Sneaker Halbschuhe Damen Reißverschluss weiß N4322-80 36 - 42 Neu14
3802	ETNIES LO CUT II GREY / BLACK / ROYAL Kingpin Fader [ 4101000365033 ] NEU OVP
3803	Puma Damen Sneakers , Grün Faas 300 Sv2 PWRCOOL Damen Turnschuhe Große ; 38 - 42.5
3804	WMNS Nike Dbreak Gr . 40 Neu & OVP CK2351 103 Damen Sneaker
3805	Herren Sneaker Sportschuhe Freizeitschuhe Schnürschuhe Schuhe grau 52790
3806	Adidas Original Zx 750 ROT HERREN Turnschuhe Alle Größen Verfügbar
3807	Kennel & Schmenger Sneakers - Black - 38 - Neu mit Etikett & Karton
3808	SUPERGA Damen Sneaker Schuhe Cotu Classic schwarz full black 2750 NEU + OVP
3809	Converse All Star 70 Mission V OX Leder Damen Sneaker Schuhe Weiß White 565370C
3810	Adidas Originals STAN SMITH PK Prime Knit Sneaker Gr .38 - 42 *** NEU + OVP ***
3811	Bally sneakers Gr . 44
3812	New Balance U410BBY Herren Sneaker Schuhe Turnschuhe Classics
3813	Adidas Yeezy Boost 350 V2 White / Triple White gay used
3814	Fila DISRUPTOR LOW Damen Sneaker Turnschuhe Weiß White Gr 40 1010302.1 FG NEU
3815	NEU SKECHERS Damen Sneakers Turnschuh Memory Foam BREATHE-EASY-JACKPOT Schwarz
3816	Etnies Marana Herren Sneaker | Turnschuh | Sportschuh | Leder - NEU
3817	Damen 77 Lifestyle Schuhe Kunstleder Sneaker Schlangenhaut-Optik weiß B20110358
3818	Komfortable Basic Herren Sneakers Low Schnürschuhe Helle Sohle 810349 Schuhe
3819	ASICS ONITSUKA TIGER AARON D3C3Y-5801 SCHUHE FREIZEIT SNEAKER NAVY WEISS 40/42 ,5
3820	Josef Seibel Sina 65 Damen Sneaker low Turnschuhe Sportschuhe Freizeitschuhe
3821	!!! TOP ! Victory Herren Turnschuhe Sneaker Schnürschuhe Schwarz Gr .42
3822	Nike Air Force 1 Sneaker Schuhe weiss oft und lange getragen Used
3823	New Balance WT574ATA grau / bunt , Damen Sneaker , NEU im Karton
3824	Ara Sneaker Lissabon Fusion street grau Schnür Halbschuh Leder Stretch 44050 76
3825	adidas PureBoost X Trainer Damen Fitnessschuhe Laufschuhe Sport Schuhe schwarz
3826	adidas Ultra 4D 5.0 Sneaker Laufschuh Herren G58160 Black Grey NEU
3827	ON Running Cloudflyer WP Waterproof Herren Gr . 44 Sport Lauf-Schuhe in schwarz
3828	U.S. POLO ASSN. Sneaker Turnschuhe Herrenschuhe Freizeitschuhe NOBIL003A-WHITE
3829	Damen Sportschuhe Slip Ons Strick-Optik Flache Profil-Sohle Schuhe 901442
3830	NEU SKECHERS Damen Jogger Sneakers Turnschuh Memory Foam OG 90 RAD RUNNERS Blau
3831	Herren Sportschuhe Slip Ons Fitness Laufschuhe Strick Sneaker 832953 Schuhe
3832	Damen GCDS para logo cc94w010010
3833	Art 487 Turnschuhe Schuhe Sneaker Sportschuhe Neu Herren
3834	K-SWISS Damen Schuhe Sportschuhe 37 - 41 Blade Max Endure 92796056 Frauen Neu
3835	Schuhe Sneaker Duffs Gr . 38,5 ( eher Gr .38 ) Wildleder und Textil
3836	NEU SKECHERS Damen Sneakers Turnschuhe Freizeitschuh EMPRESS HONEST WALK Schwarz
3837	Reebok CL Nylon Sneaker Weiss Grün
3838	Chekich CH257 Echt Leder Sneakers | Herren Damen Sneaker Schuhe | Sportschuhe
3839	Adidas Herren Schnürschuhe Sneakers Sportschuhe Laufschuhe schwarz NEU
3840	Uncle Sam Damen Sneaker Barfußschuhe in Pink / Blau
3841	Damen 77 Lifestyle Sneaker zum Schnüren Stitches rosa weiß B19020627
3842	adidas Hulton SPZL 40 40,5 41 46,5 DA8756 spezial liga indoor super
3843	Herren Leichtlauf Sabots Pantolette Clogs Sneaker Slipper Freizeitschuh NEU 036
3844	Fila Disruptor Straps Damen Weiß Marineblau Freizeit Grob Lifestyle Turnschuhe
3845	Adidas Superstar white Sneaker Schuhe weiß AQ8334
3846	Nike Jordan REVEAL BG Triple Black Größe 36 36,5 schwarz 834126 020 retro
3847	Nike Squash-Type Gr . wählbar CW7578 100 322R Turnschuhe Sneakers Freizeitschuhe
3848	New Balance ML574HMK Herren Sneaker Dunkelblau Freizeitschuhe Sportschuhe
3849	Converse Sneaker Chucks Hi EU 44 UK 10 113951 Limited 45 43 Mosh Pit TOP NEUw
3850	HERREN SCHUHE SNEAKERS HOKA ONE ONE MS BONDI 7 [ 1110518 POFS ]
3851	Adidas Terrex AX4 FZ3280 Herren Trekking / Wanderschuhe
3852	Nike Court Borough Sneaker Turnschuh Sportschuh BQ5448-400 blau gelb neon Unisex
3853	New Balance 247 Herren Damen Sneaker Leder Sportschuhe Freizeit MRL247N3
3854	Übergröße Herren Sneaker Turnschuhe Sportschuhe Klettschuhe 20478 Grau Blau
3855	Camp David Leder Schnürboots Neu Boots Sneaker Schnürschuh Gr .46 NP 119,95
3856	NEU Puma Palace Guard Größe 40 Sneaker Trinomic 370063-02 TOP
