Record Number	Title
706	Puma AXIS Plus 90s Unisex Fitnessschuhe Sneaker Turnschuhe 370287 White SALE
707	DOLCE & GABBANA Leder Wildleder Low Top Sneaker Schuhe NIGERIA Weiß Gold 08858
708	adidas Damen Freizeit-Fitness-Schuhe Trendschuhe Sneaker Grand COURT weiß blau
709	NIKE ROSHE ONE DMB BRIGHT CRIMSON LTD 37.5-42 NEU160 € rosheone rosherun free 5.0
710	Vans Unisex Kinder Ward V-Velcro Canvas Sneaker
711	Adidas NMD R1 schwarz günstig neu
712	Adidas Ultra Boost 20 Sneaker Laufschuhe Turnschuhe Schuhe blau EG0758 NEU
713	Adidas High Top Sneaker 424 Turnschuhe Superstar Allround
714	Nike SB Dunk Low Pro Parra EU44 US10 Sneaker Schuh Fashion Sportschuh sportlich
715	New Balance M1300JP3 + ML574GYC Bundle Pack new in box US 12 UK 11,5 , EUR 46,5
716	TIMBERLAND ROZARI OXFORD HOOK & LOOP 36-37 .5 NEU120 € classic earthkeeper sneaker
717	s.Oliver Sneaker 24635 Damen Freizeit Schuhe Slipper slip on bequem SOFT FOAM
718	NIKE AIR MAX 93 HERREN SCHUHE SNEAKER FREIZEITSCHUHE WEIß Blau 306551 100
719	H.I.S Herren Schuhe Sneaker Freizeitschuh Schnürschuhe Blau
720	PUMA Suede Classic Cat Herren Sneaker Turnschuhe Blau Blue Gr . 40 - 41 NEU
721	Djinns nice Harris Tweed Herrenshuh Sneaker Schuhe 50532
722	Puma Shuffle Unisex Sneaker | Turnschuh | Sportschuh | Textil , Synthetik - NEU
723	Neue Louis Vuitton Nike Air Force 1 Sneaker by Virgil Abloh , Gr . 9,5 Limitiert
724	Onitsuka Tiger Mexico 66 Turnschuhe Schwarz Wildleder Zehen Weiß ASICS Leder
725	Adidas GAZELLE BB5476 Herren Turnschuhe Sneaker Schwarz Leder Originals Gr 42-46
726	Nike Air Max 200 weiß / grau / blau / orange Herren Sneaker CT1262-001
727	New Balance Damen Sneaker 500 819941-50
728	Nike Tanjun , leichte Sport-Sneaker , Blau / Weiß , Herrenschuhe * Übergröße *
729	Nike Air Max 97 Gr .40 M Sneaker Schuhe BV1985 001 Retro Schuhe Damen Herren Runn
730	Lacoste Europa Herren Sneaker low Glattleder sportiv Muster Uni Sohle flexibel
731	Nike Venture Runner Herren Sneaker Turnschuhe Sportschuhe CK2944-009
732	Damen - Leinen - Knöchelschuh Magnus Gr . 34 - 39
733	Damen Sneakers Metallic Prints Sportschuhe Schnürschuhe 814851 Schuhe
734	New Balance ML574 Utility weiß U574TE2 Low-Top Sneakers Freizeitschuhe Sneaker
735	Converse 159628C Ctas ULTRA MID Leder Lite Schuhe Sneaker Boots 45 46 Weiß Schwa
736	Nike Air Jordan 1 Low | White Black Grey Shadow | Neu | 44 | Weiß Grau
737	ON Running Cloud 5 Damen Sneaker Schwarz 59.98905 Sport Schuhe Laufschuhe NEU
738	ORIGINAL ADIDAS VS PACE DA9997 HERREN TURNSCHUHE LAUFEN FITNESS SPORT WEISS
739	adidas NMD R1 V2 H01485 Schwarz Black Sneaker Turnschuhe Herren Sport Originals
740	NEU mit Karton , Nike Dunk Low Retro White Black - EU 38,5 ✅
741	Adidas Neo Cf QT Racer Cloudfoam Memory Foam Sneakers Sportschuhe 7.5 9 41
742	New Balance Lifestyle GM500CR1 Moonbeam Herren Sport Freizeit Fashion Sneaker
743	IMAC Damen Sneakers Leder Textil Schuhe taupe Schnürung Gr 39 40 41 42 NEU R141
744	New Balance CM997HVN gelb / grün , Herren Sneaker , NEU im Karton
745	Converse Chucks in 49 . Gay Destroyed Abgerockt Used . Für Liebhaber geeignet
746	Onitsuka Tiger Mexico 66 Damen Cream Cozy Pink Schuhe Sneaker Beige Rosa Orange
747	New Balance ML574ER2 Herren Sneaker Freizeitschuhe Sportschuhe Rot Wildleder
748	Nike Odyssey React 2 Flyknit Damen Laufschuhe Sneaker Turnschuhe AH1016 500
749	PUMA Herren Sneaker Erupter puma black
750	nike lunar vengeance Terra + 42 43 44 44,5 Dead Stock 429860 001 vortex epic acg
751	Skechers Flex Appeal Sneaker | schwarz / gold | Memory Foam | Größe 43
752	Nike Air Zoom Pegasus 37 Herren Jogging Schuhe Neu Laufschuhe Schwarz Pegasus 37
753	adidas Originals 90er-Jahre Schuhe coole Herren Retro-Sneaker Yung-1 Grün
754	Adidas Gazelle Herren Sneaker low Turnschuhe Sportschuhe Freizeitschuhe
755	Asics Gel Lyte III 3 Purple Black H5V0L 3390 ( Größe 41,5-45 )
756	Original NIKE AIR HUARACHE RUN Sneaker , blau , Größe 37 ( 40 ) - TOP !
757	Rieker Antistress Damen Ballerinas Slipper Halbschuh Slip ON Comfort Blau Gr . 41
758	Adidas Sportschuh , Sneaker , 3 Male getragen , absolut neuwertig
759	Nike Air Jordan 1 Mid GS Sonic | verschiedene Größen | New & Ungetragen ✅
760	DIESEL EXPOSURE 00Y833 PR052 T8013 Herren Sneaker Stiefel Schuhe Men Shoes MOR
761	Gorilla Wear Perry High Tops Pro -- Black / Gray Camo SALE
762	Converse Chucks All Star OX Größe 40 Red Rot M9696C Neu Mega angesagt
763	4F OAK Lifestyle Sneaker aus Leder für Herren D4L22-OBML200-24S
764	adidas D.O.N. Issue 2 Donovan Mitchell - FW8517 Herren Basketball Schuhe Sneaker
765	Fila Damenschuh weiß Gr . 39 , kaum getragen
766	CANVAS Gothic Unisex Stoffschuh BROKAT , Skull Stickerei ( schwarz )
767	Lonsdale Herren Turnschuhe Sportschuhe Sneaker Laufschuhe Casual Camden 054
768	air force one weiß
769	Vivobarefoot Herren Trainer Primus Swimrun FG Foldable Lace-Up Running Mesh
770	adidas Originals x Alexander Wang Futureshell Sneaker Triple Black EE9027 Unisex
771	adidas Yeezy Boost 350 V2 Dessert Sage | US 12.5 | EU 47.5 | FX9035
772	New Balance CW997HBF
773	Reebok Herren Schuhe Work N Cushion 3.0 Herrenschuhe Sneaker Turnschuhe
774	Converse C Taylor All Star HI Chuck Schuhe Sneaker Lightweight Nylon grün
775	Herren Sneaker Hi-Top Segeltuch verschiedene Farben Blau Schwarz Freizeit-Schuh
776	Under Armour Mojo 2 3024134-102 Herren Sneaker Sportschuhe Freizeitschuhe
777	Herren Damen Schnürer Cut Out Sportschuhe Bequeme Sneaker 833723 Schuhe
778	Puma ST Runner v2 Full L Herren SneakerSchnürschuh Halbschuh Sommerschuh Schuhe
779	US 9 / UK 8,5 / EU 42,5 - On Cloud Nova Running - 2.699.823
780	Rieker Damen Sneaker gelb Gr.37-42 L2820-68 ANTISTRESS
781	NIKE iD | KOBE AD | EXODUS | AQ3740-991 | EU43 UK8 .5 US9 .5
782	Nike Dunk Low Green Glow ( Womens ) Sneaker in verschiedenen Größen
783	Nike Air Max 97 ( BG ) Gr . wählbar Neu & OVP AR0018 001
784	NEU SKECHERS Damen Sneakers D'LITES - GLEEFUL Schwarz Winterstiefel Stiefel
785	Puma Ralph Sampson 70 Mid Archive Herren Sneaker Leder Weiß 374961-03 Schuhe NEU
786	Nike Air Max ST Running Trainers 705003 104 Sneakers ( 37,5 )
787	Adidas Handball Kreft Spezial blau weiß Herren Low-Top Sneakers Wildleder NEU
788	Boxfresh Schuhe Sparko FABB chambry grey