Record Number	Title
1754	Kappa Samura 242964OC Schwarz 1111 Herren Smooth Foam Sport Freizeit Sneaker Neu
1755	Ecco Terracruise Herren Schnürschuhe in Blau
1756	Herren Schuhe adidas TERREX SWIFT SOLO D67031
1757	ORIGINAL ADIDAS LIGRA 6 D97698 HERREN SNEAKER TURNSCHUHE FITNESS SPORT SCHWARZ
1758	Skechers SKECH AIR INFINITY 12302 Schwarz BKWP Memory Foam
1759	Nike Air Max Impact
1760	Nike Air Jordan 1 Low Grey Shadow Toe Grau | Neu | 44,5 EU
1761	Converse one Star Ox low silber 161590C unisex
1762	Converse Plateau Chucks CTAS Lift ox Platform Damen Sneaker black / white 560250C
1763	NEU Converse Chuck Taylor All Star Gemma OX 41 Sneaker Schuhe CT Chucks 553459C
1764	Adidas ZX 8000 GTX x IRAK 2020 A-ZX Series FX0371 Neu new US 12 UK 11,5 EUR 46 2/3
1765	Napapijri Vicky Damen Sneaker NP0A4GA6 Schwarz 0411 Fashion Freizeit Schuhe Neu
1766	Superga 2750 Cotu Classic Damenschuhe Black , SONDERPREIS , Gr . 36 + 42
1767	ADIDAS Terrex AX3 Herren Schuhe Trekking Wandern Outdoor , FV6852 / P4
1768	adidas Terrex Schuhe
1769	Herren Schuhe adidas TERREX AGRAVIC TR U EG5915
1770	Herren Laufschuhe Sportschuhe Freizeit Draussen Turnschuhe Joggen Tennis Sneaker
1771	adidas Originals Hamburg Fish Market Sneaker Schuhe Weiß EF5673
1772	Nike Dunk Low Retro Premium Fossil Rose EU 44,5 / US 10,5
1773	Nike Jordan Why Not Zer0 .1 Low AR0043-003 Herren Sport Schuhe Sneaker Neu 51,5
1774	Original FILA DISRUPTOR 2 SNEAKER DONNA White Sneakers FS1HTZ3071X
1775	Skechers Sport Damen ULTRA GROOVE Sneakers Women Pink
1776	Skechers UNO STAND ON AIR Herren Schwarz Schuhe Freizeitschuhe Sneaker 52458-BBK
1777	Skechers RELAXED FIT SELMEN-WEST HIGHLAND Damen Outdoor WIDE FIT schwarz
1778	DC SHOES SCHUHE LYNX MULTI BLAU BLUE LEDER ADYS100425-MLT SKATER SNEAKER
1779	Payntr Herren Bodyline 263 All-Round Cricket Schuhe Weiß Sport Atmungsaktiv
1780	New Balance ML574V Herren low-top Sneakers schwarz Freizeitschuhe Wildleder NEU
1781	Reebok Torch Hex Wmns white-sunglow-cyan Sneaker Damen Schuhe DV8579
1782	adidas Originals ZX 1000 C , Retro-Sneaker A-ZX Reihe , Gr . 42 , FW1485
1783	Damen Sportschuhe Turnschuhe SNEAKER Schuhe FReizeit
1784	Nike Run Swift 2 Herren Sneaker Turnschuhe Sportschuhe CU3517-404
1785	Skechers Sport Mens DYNAMIGHT Sneakers Men Blau
1786	ADIDAS BOOST 45 1/3 USED DIRTY
1787	Gayle Nike Air Force 1 mid - heavy used , Gr . 44 ( 10 ) , Sk8erboy
1788	in Portugal in Handarbeit gefertigt . Frauen schuhe von Clamp
1789	Herren Fitness Running Sneaker Turnschuhe Sportschuhe Laufschuhe Freizeitschuhe
1790	NIKE Air Max plus tn 3 Größe 45,5 / US11 ,5
1791	ADIDAS NMD_R1 PRIMEBLUE GZ9261 SNEAKER HERRENSCHUHE LAUFSCHUHE
1792	Adidas Marathon 86 Spezial Sneaker Freizeitschuhe Sportschuhe 40 41 42 43 44 45
1793	Reebok EX-O-FIT HI Women Mens Sneakr 3478 Black Schwarz Gr :36 Classic Princess
1794	KAPPA MANGAN 242764 Herren Damen UNISEX High Top Sneaker Turnschuhe Gr . 36-46
1795	Neu original Damenschuhe Fila Ray Tracer wmn 1010884-25Y Sneaker Turnschuhe
1796	Art 704 Neon Turnschuhe Schuhe Sneaker Sportschuhe Neu Herren
1797	Asics Gel Kinsei 6 LaufschuheT642N Grösse 49 UK 13 Herren Sonderpreis ! TOP NEU
1798	NEU SKECHERS Damen Fitness Sneakers Loafer Slipper Stoff GO WALK 4 ACHIEVER Grau
1799	Puma Trinomic XS500 X Miitaly Herren Turnschuhe Braune Hergestellt in Italien
1800	Nike SB Dunk Low Heineken ( 2003 ) - EU44 US10 - OG None - Used
1801	Damenschuhe Vty Größe 39
1802	Adidas ZX 4000 4D Futurecraft alphaedge y3 runner y-3 ash prism yeezy ultra
1803	Jordan 1 High ' Game Royal ' | US 7Y ( GS ) - Eu 40 VNDS
1804	adidas Originals Nite Jogger Sport Schuh Turnschuhe Sneaker EF5414 Neon Grün
1805	Zeha Berlin Carl Häßner Club Schuhe braun Sneaker Rennrad Singlespeed Fixi
1806	Leder Herren Stiefel Sportschuh Winter Schuhe Outdoor Boots Warm Gefüttert S_D45
1807	DOCKERS by Gerli 40TH201-790640 Canvas Damen Sneaker Schuhe Türkis
1808	Sportschuhe Sneaker Turnschuhe Freizeitschuhe Herren Damen Schnürer Neu 17170
1809	Puma Trinomic XT-1 NYC - Weiß - Herren Sneaker - City Design - Neu / OVP
1810	TBS Schuhe CROCKY Touareg Blau Canvas Sneakers Halbschuhe Reduziert SALE
1811	LOWA MARIE GTX Damen Sneakers Gr .37 Freizeitschuh Wanderschuh Halbschuhe Comfort
1812	Converse Chucks All Star OX Größe 41 Red Rot M9696C Neu Mega angesagt
1813	Sneaker Herren 45 , großes Paket , 15 Paar , Nike , Adidas , Puma , Fila , Guess usw .
1814	Converse Schuhe All Star Ox Weiß M7652C Sneakers Chucks Weiß Gr . 42,5
1815	Acne Studios Kobe Damen Sneaker Schuhe Weiß Gr .40 Sehr guter Zustand
1816	TOP ADIDAS DROP STEP MID Herrenschuhe Turnschuhe Sneaker HIGH TOP Schwarz
1817	Nike Air Vapormax EVO Gr . wählbar Neu & OVP CT2868 100 143
1818	Bugatti Schuhe STOWE blau Herrenschuhe Sneakers 331-A7M02-1469 4141 NEU
1819	Jugendliche Schuhe adidas STAN SMITH J B32703
1820	New Balance U574TZ2 Classic Herren Sneaker Sportschuhe NEU
1821	Gola Boston 78 Snake Damen Navy Sage Sneaker Mode - 39 EU
1822	PUMA Sneaker 42 Canvas Ibiza Unisex Schwarz Freizeitschuh Fitness Turnschuh NEU
1823	Skechers FLEX ADVANTAGE 2.0 GURN Herren Schuhe Sneaker 52183 ( Grau-CCBK )
1824	adidas Equipment EQT Support Ultra CNY Chinese New Year - BA7777 Herren Sneaker
1825	Adidas EQT 2/3 F15 OG - EU 42 - US 8,5 - Neu -
1826	Fila Sneaker Stoff Grau / Weiss Gr . 39
1827	LACOSTE Court Legacy NWP SPM Herren Sneaker Turnschuhe Grau 7-29SPM0379270
1828	Converse Chuck Taylor All Star High 166264c Neon Orange Bright Crimson
1829	K-Swiss Hof II CVS VNZ Damen Sneaker Schuhe 02491012 schwarz-blau
1830	Skechers Bobs Squad Sneaker | navy / blau | Textil | Memory Foam | Größe 41
1831	PUMA MERCEDES AMG F1 DRIFT CAT DELTA Herren Grau Schuhe Freizeitschuhe 306852 02
1832	Hoka Cavu Damen Laufschuhe Sportschuhe Jogging Schuhe 1019282 BRMR Gr . 36
1833	Adidas Equipment Support ADV W 37 38 38,5 39 40 BB2328 iniki nmd 93 EQT
1834	New Balance MRL996MP 40 41 42 44 44,5 45 mrl 996 MP Suede Leather Classic 576
1835	Adidas Vespa Sneaker -- grau / grün -- US 10,5 / UK10 -- gebraucht guter Zustand -- KULT !
1836	asics Jolt 3 1011B034-006
1837	Nike SHOX TL Sneaker Schuhe Grau Orange Mens AV3595-101
1838	Damen Bequeme Sneaker Turnschuhe Laufschuhe Socken Schuhe Freizeitschuhe Trendy
1839	NIKE LAB SOCK DART SP #be true Gr .42,5 UK .8 686058 019 black white rainbow
1840	Halbschuhe Sneakers von Café Noir in Größe 38 . ungetragen !!!!! Mit Karton !!!!!!
1841	adidas Herren James gehärtet Vol 1 Basketball-Schuh Sportschuhe NEU bw0546 UK
1842	Nike Dunk Low Sb St. Patricks Day EU44 US 10 | NEU & Ungetragen | Händler
1843	Converse One Star Schwarz Leder Sneaker Gr .44 US 10
1844	Neu Speedcross 3 Herren Outdoorschuhe Laufschuhe Cross Schuhe Hikingschuhe 40-47
1845	Nike Herren Laufschuh " Revolution 6 NN " black / white-iron grey
1846	Pantofola d'Oro Ascoli Botanica
1847	Nike Dunk High Championship Navy GS Sneaker DB2179-104 NEU Damenschuhe
1848	PUMA Kaia Platform L Damen Sneaker Frauen Schuhe Basics Neu
1849	Boxfresh SWAPP FUR Herren Winter Sneaker Schuhe LEA WWXY E-BFM0186GA1 grau
1850	New Balance Herren Sneaker 500 burgundy
1851	AJ4 Lila-rot Freizeitsportschuhe Metallic ( CT8527-114 ) Fashion Damen Herren DE
1852	Nike Air Force 1 '07 - Kinder Sneaker
1853	Asics Damen Gel-Kayano 28 Lite-Show Turnschuhe Laufschuhe Sneaker
1854	adidas UltraBoost 20 Sneaker Laufschuhe Parley Weiß Blau ( FV8324 ) NEU
1855	New Balance Damen 997h ' Sneaker
1856	ADIDAS ZX FLUX W BY9214 DAMEN LAUFEN SNEAKER TURNSCHUHE SPORT WEISS ROSA NEU
1857	REEBOK AZTEC OG NEU Vintage Retro RAR blau atmos patta max supreme boost
1858	Bugatti Sneaker 321924016900 4100 Dark Blue Blau Mesh Halbschuh Gummisenkel
1859	Damen Sneaker Slip Ons Prints Wildleder-Optik Slippers 821351 Schuhe
1860	Diadora Herren Flamingo 4 WIN Laufschuh Unisex Sneaker grau
1861	Tommy Hilfiger Leder Sneaker Leon 5A Black Gr . 43 Neu & Ovp
1862	[ FILA ] Sneaker Turnschuhe Gr . 40
1863	Nike Air Max Command Leather Herren Sneaker Schuhe Echtleder Classic 749760-012
1864	New Balance 574 Herren Sneaker low Freizeitschuh Halbschuh Leder Mesh Gummisohl
1865	Sixtyseven Schuh Weiß 30259-C47894 Damen Sneaker Wechselfußbett REDUZIERT !!
1866	Nike Air Force 1 '07 LV8 Weiß Herrenschuh Damenschuh DV3501-100
1867	FILA NEU Große 41 Disrupter Damenschuhe Frauen Weiß 820067 Sneaker Neu mit Karto
1868	Asics Herren Gel-Kayano 28 Turnschuhe Laufschuhe Sneaker Blau Gelb Sport
1869	Nike Air Max Plus University Blue Nature DV3439 001 Sneaker Schuhe Sportschuhe
1870	NEW Air Jordan 1 High OG University Blue 555088-134 Unisex
1871	Damen Ballerinas Sportliche Stoffschuhe Slipper 79659 Mode
1872	Nike Air Force 1 low Weiß Herrenschuh Neu
1873	VANS Filmore Retro Sport Sneaker Skater Unisex canvas / Leder Sneaker rot
1874	LACOSTE La Piquee 120 Weiss 739CMA0023082 Herren Fashion Freizeitschuhe Neu
1875	New Balance W480LE6 Laufschuhe Running Lifestyle Sneaker B6 / 165 blau Gr . 37,5
1876	Emerica The Romero Laced dark blue / gum Skater Sneaker / Schuhe blau
1877	ADIDAS Turnschuhe Tennisschuhe Sneaker weiss Gr . 42 2/3 ( 8,5 )
1878	Petrolio Herren Schuhe Sneaker Freizeitschuh Schnürschuhe Leder Grau
1879	Wasserschuhe Aqua Sock Yoga Übung Pool Strand Tanz Schwimmen Slip ape
1880	Adidas ZX Flux W Türkis Bunt Damen Low-Top Sneakers Freizeitschuhe Casual Schuhe
1881	adidas SL 72 S.W. Star Wars Han Solo in 43 1/3 UK 9 US 9.5 neu BNWT G17448
1882	Skechers Summits-South Rim Herren Schuhe Sneaker Turnschuhe 52812 ( Schwarz-BBK )
1883	Adidas Japan Sneaker Freizeitschuhe Laufschuhe Sportschuhe Neu Größe 40
1884	LACOSTE Herren Menerva Sport Joggingschuhe Sneaker Weiß
1885	Nike Air Max 95 DO6704-001 Herren Sportschuhe Sneaker
1886	NEU SKECHERS Damen Sneakers SOLAR FUSE-BRISK ESCAPE Sportschuh Training Violett
1887	Puma Herren Sportschuhe Sneaker EUR 41 Nr . 22-M-6109
1888	Nike Air Jordan 1 Mid GS | Triple White | Weiß | 36,5 - 37,5 - 38 - 38,5
1889	Etnies Fader Herren Black White Sneaker Schlittschuh - 7.5 UK
1890	Adidas Clemente lo Clip Herren Sneakers weiß schwarz Freizeitschuhe
1891	Etnies Lo-Cut black / black / gum Skater Schuhe / Sneaker schwarz Größenauswahl
1892	SALMING VIPER 4 48 49 NEU 140 € indoor handball hallenschuhe ninetyone 91 kobra
1893	Neu Herren Damen Laufschuhe Sportschuhe Sneaker Freizeit 1516 Schuhe Gr . 36-46
1894	Damen Sneaker High Warm Gefütterte Turnschuhe Schnürer Schuhe 824303 Trendy Neu
1895	adidas Crazychaos cloudfoam Damen Freizeit Mode Sport Sneaker Schuhe EG7998 neu
1896	hey dude Damen Slipper Wendy Sox Peacock Bunt Schuhe 121928341
1897	Asics Gel Superion 2 Herrenlaufschuhe ( 1011A039-001 ) Gr : wählbar neu in Karton
1898	Keen Wanderschuh Schuh VERSATRAIL Gr . 40-48
1899	Puma Basket Blue 40.5 EUR
1900	Puma R78 Runner Unisex Sneaker Sportschuh 373117 Schwarz
1901	Krüger Damen Sneaker Trachten Shuhe floral Blumen Print kariert Spitze
1902	Tommy Hilfiger Essential Sneaker Freizeitschuhe Schuhe Herren FM0FM03424
1903	New Balance 530 Retro White Silver Navy Running Shoes MR530SG Men 's / woman DE
1904	FILA Orbit Herren Sneaker Freizeit modisch grape leaf NEU
1905	adidas Nebzed Sneaker Freizeitschuhe Schuhe Herren Damen Schwarz EG3693
1906	SKECHERS 15600 / WHT Go Walk Joy Damen Sneaker Slipper weiß
1907	ORIGINAL ADIDAS ASWEEGO CLIMACOOL F36324 TURNSCHUHE FITNESS SNEAKER SCHWARZ
1908	Fila Retronique 22 Wmn Damen Sneaker | Turnschuh | Sportschuh | Veloursleder ( Su
1909	Keen Herren Sneaker Uneek 1023498 Schwarz , Wasserabweisend , Luftcell Fußbett , Gr .42
1910	Herren Damen SportschuheTurnschuhe Sport Schuhe Sneaker Runners Art.-Nr .1634
1911	Nike Revolution 6 Next Nature M DC3728-001 Laufschuh schwarz
1912	adidas ZX 7000 30 Jahre TORSION , Gr .43 1/3 , FU8404
1913	Converse Unisex Chucks All Stars Hi High Top Sneakers Schuhe NEU
1914	adidas Originals ZX 700 Herren Sneaker Schwarz FZ2818 Sport Freizeit Schuhe NEU
1915	Gucci Schuhe Sneaker Retro Neu 650eur
1916	Damen Sneaker Low Turnschuhe Schnürer Bequeme Freizeitschuhe 834021 Schuhe
1917	Semler Damenhalbschuhe KOMFORT SCHNÜRER Grau-Perle Leder Sneaker Weite H
1918	Damen Sneakers Denim Jeans Slip-ons Slipper Fransen Flats 814498 Trendy Neu
1919	Puma Leader VT SL Sneaker Schuhe Turnschuhe Herren Tazon Viz UVP 59,95 € 365291
1920	K-Swiss Herren Arvee 1.5 Sneaker Schwarz Turnschuhe Sportschuhe Schuhe NEU
1921	Art 642 Neon Turnschuhe Schuhe Sneaker Sportschuhe Neu Damen
1922	Herren Damen Wasserschuhe Strand Barfußschuhe Surfschuhe Schwimm Badeschuhe
1923	Herren Sneaker Sportschuhe Turnschuhe Laufschuhe Runners Neu 52812
1924	Puma RS 9.8 Cosmic Sneaker Gr . 42,5 Sport Freizeitschuhe Schuhe NEU
1925	Skechers Uno Stand On Air Herren Sneaker | Turnschuh | Sportschuh - NEU
1926	Damen Herren Sneakers Low Profilsohle Freizeit Turnschuhe Schnürer 79430 Schuhe
1927	Adidas Schuhe Pure Boost Sneaker Turnschuhe Freizeitschuhe Khaki Trace S81992
1928	Converse Chuck Taylor CT Spec Ox Unisex Sneaker 114051 grau
1929	PUMA " BMW MMS Future Kart Cat " Sneaker , Gr .42 ( entspr . Gr . 40 )
1930	New Balance 850 OG Reissue ML850YSC US9 - Aime Leon Dore
1931	Adidas NMD R1 Star Wars Stormtrooper Sneaker Turnschuhe Schuhe weiß FY2457 NEU
1932	New Balance ML 574 Wildleder grautöne Herren Low-Top Sneaker Freizeitschuhe NEU
1933	New Balance ML373 KSP black Schuhe / Sneaker Größenauswahl !
1934	Puma Unisex Sneaker Rebound JOY 374765
1935	Damen Sportschuhe Neon Laufschuhe Runners Sneakers 74688 Schuhe
1936	PUMA R22 Signature Sneakers Unisex Schuhe Basics Neu
1937	Adidas Sportschuhe Ligra 6 Unisexschuhe Übergrößen Weiß
1938	Bequeme Damen Basic Sneakers High Schnürer Freizeitschuhe 79875 Schuhe
1939	LLOYD Sports Sneaker schwarz Gr . 43 / 9 Leder guter Zustand
1940	FILA Damen Sneaker Schuhe Gr .39 US size 7 UK size 5 1/2 women sneaker
1941	Nike Air Jordan XXXI 31 " Space Jam " Black Anthracite 845037 002 US_9 Eur 42.5
1942	Tommy Hilfiger Tommy Jeans Essential Low Cut Herren Sneaker low Turnschuhe
1943	NEU Original Adidas Yeezy Boost 350 V2 Yecheil / Yechei ; Gr . 40,2 / 3 ; FW 5190
1944	Schuhe Asics Onitsuka tiger mexico 66 Mann Frau D832L Schuhe Premium Leather
1945	Puma Smash v2 Buck JR Junior Kinder Sneaker Schuhe Sportschuh 365182 14
1946	Art 658 Sneaker Turnschuhe Schuhe Sportschuhe Slipper Laufschuhe
1947	Adidas Samba OG core black white gum5 Sneaker Schuhe schwarz BB3114
1948	Nike Shox NZ gebraucht , grün weiß , noch tragbar , Größe 46
1949	HERREN SCHUHE SNEAKERS NEW BALANCE [ ML574NT2 ]
1950	Adidas PRADA Superstar sneakers women Damen Gr . 39 UK 6 US 6.5 NP :500 € SOLD OUT
1951	Damen Herren Barfußschuhe Strandschuh Wasserschuhe Watschuhe Laufschuhe Sneakers
1952	Blauer USA Herren Sneaker Low Top Schuhe Detroit dunkel blau navy
1953	Salomon GoreTex XA PRO 3D Ultra GTX Gr . 46 2/3 ( 46,5 ) Outdoorschuhe - rot -
1954	NEU SKECHERS Herren Sneakers CROWDER - ARMEL Slipper Schlupfschuhe Schwarz
1955	Fila Noclaf Cb Mid Herren Sneaker | Turnschuh | Sportschuh | Veloursleder ( Suede
1956	Herren Ultraleicht Laufschuhe Turnschuhe Barfußschuhe WasserdichtRunning Schuhe
1957	Herren Skechers Turnschuhe Freizeit Gipfel 52811
1958	Lacoste Carnaby Evo 319 beige gold Sneaker Damen
1959	Lakai Skateboard Footwear Skate Schuhe Shoes Griffin VLK Grey Suede 13/48 ,5
1960	ADIDAS CF ADVANTAGE DAMEN SNEAKER
1961	SKECHERS BOBS Damen Freizeit - / Laufschuh " SQUAD - Glitz Maker " weiss
1962	Porsche Design Adidas Herren Schuhe PDS Ultra Boost TRA EU 47 1/3 UK 12 US 12.5
1963	Nike Air Zoom Terra Kiger 5 ( AQ2219-001 ) Trail Running Schuhe
1964	Ausgefallene Turnschuhe Sneaker von Legero in Craquele-Optik schwarz Gr . 38
1965	Buffalo Damen Leder Sehr Hoch Plateauschuhe In Jeder Farbe EU Große 35 - 41
1966	Allbirds Sneakers Damen Freizeitschuhe Turnschuhe Gr . DE 39 kein Eti ... # 64b3c11
1967	Nike Air Max Plus OG Hyper Blue BQ4629 003 UK_5 .5 US_4 Eur 36
1968	MSGM RBRSL Rubber Soul Edition Fluo Floating Sneakers Turnschuhe Shoes Schuhe 40
1969	Damen Turnschuhe Luftkissen Stricken Sneaker Laufschuhe Freizeit Schnürer Schuhe
1970	Asics Herren Sneaker JAPAN S ™ NEWSTALGIA 1201A025
1971	Damenschuhe - Sneaker - Sport - Reebok - schwarz - gebraucht - Gr - 39
1972	Converse Chucks All Star HI Größe 44 blau navy M9622 Neu
1973	NEW BALANCE NB ML574EAG SNEAKER HERRENSCHUHE Sportschuhe GRAU **
1974	Adidas Gr . 37 Superstar Girl Sammler & Liebhaber ❤ Oft Getragen
1975	Paul Green Sport Schuhe Schnürer Leder Schwarz Sneaker Damen Gr . 5 - 38
1976	Puma ST Runner v2 Full L Herren Schuhe Sneaker Turnschuhe 365277 ( Weiß 09 )
1977	Herren Wander Sportschuhe Laufschuhe Outdoor Walking Wasserdichte Turnschuhe
1978	Nike SB Dunk Low Night of Mischief Halloween - EU40 .5 US7 .5 - Neu - Blitzversand
1979	Nike Air Jordan 1 Low Bred Toe ( GS ) | 553560-612 | 38,5 - 40 | Neu OVP ✅
1980	HERREN SCHUHE REEBOK CL LEATHER CLASSIC NEU SNEAKER * [ 2267 ]
1981	getragene schuhe sammler
1982	Nike ZoomX SuperRep Surge CU7627-001 Herren Trainings Sport Fitness Schuhe Grau
1983	CHRISTIAN LOUBOUTIN Loubikick Flat Multi-Layered High Top Sneakers
1984	Adidas Terrex Wanderschuhe Trailmarker Goretex US 11
1985	G1446 sneaker donna MSGM ivory shoes woman
1986	Art 980 Airsoft Laufschuhe Turnschuhe Schuhe Sneaker Sportschuhe Herren
1987	Skechers Stamina - Cutback Herren Sneaker Schuhe Turnschuhe 51286 ( Grau-GYOR )
1988	Nike SB mns Skateschuh Low Check - cool grey - Neu & OVP
1989	K-SWISS Court Tiebreak SDE Damen Sneaker 97012-044-M Schwarz
1990	Puma Blaze Knit Trinomic black Sneaker Laufschuhe schwarz 359996 03
1991	Damen Sportschuhe Strick Laufschuhe Slip On Sneaker Turnschuhe 832681 Trendy Neu
1992	Herren Atmungsaktiv Herrenschuhe Mode Komfortabel Freizeit Draussen Sneaker Gym
1993	Asics Running Gel Lyte 5 Birch Coffee
1994	ESMARA ® Damen LED Sneaker / mit Beleuchtung / Ladies Schuhe Turnschuhe Mädchen
1995	Neu new balance Mens 500 " seasonal Core " Sneakers Low 20264691 für Herren
1996	Paul Green Sneaker 4652 034 ice flower weiß PG + Relax Weite Leder Einlage
1997	Spalwart Marathon Trail Low Mesh - Black 9999
1998	Adidas Superstar 80s Herren Sneaker Turnschuhe Leder weiß BB2231 Gr . 44 2/3 NEU
1999	UNDER ARMOUR HOVR PHANTOM SE Herrenschuhe Laufschuhe Jogging Sneaker Turnschuhe
2000	adidas Handball Spezial BD7633
2001	Asics Gel-Respector 46 " Virtual Space Pack " Blue Print / Blue Print-White
2002	New Balance W530 GAR grey Schuhe Sneaker grau
2003	Puma Unisex Sneaker ST Runner v2 Full L 365277
2004	Herren Milit?rstiefel Armeestiefel Wanderschuhe Outdoor Trekking Kampfstiefel
2005	CATERPILLAR / Cat Herren Stiefel Schnürboots braun brown Gr 43 Echtleder NEU
2006	Neu NikeAir Max Plus TN Tuned 1 Herren Sneaker verschiedene Größe
2007	Nike Air Jordan 3 Cardinal Red Neu OVP new release CT8532-126
2008	Schuhe Asics Onitsuka tiger mexico 66 Sportschuhe Leder THL408 Mexiko Mann Frau
2009	Adidas VS Pace Laufschuhe Trainingsschuhe Herren Sportschuhe schwarz 42 2-3
2010	Art 653 Neon Sneaker Turnschuhe Schuhe Sportschuhe Neu Herren
2011	ASICS GEL-QUANTUM 180 5 1021A185-001 Black Schwarz Running Laufschuhe Sneaker
2012	Damen Sneaker Low Spitzenstoff Freizeit Schuhe Schnürer 826505 Trendy Neu
2013	Adidas Runfalcon 2.0 Turnschuhe Laufen Für Frau Schwarz GW6251
2014	Skechers * Memory Foam * Air Cooled *
2015	0668O sneakers donna SAUCONY VIZIGLO KINVARA 4 silver / corallo shoes woman
2016	New Balance WL 574 CL2 Sneaker Damen weiß
2017	Nike Air Zoom Pegasus 37 EK - Eliud Kipchoge - DD9478-100 Herren Laufschuhe Weiß
2018	NEU SKECHERS Herren Sneakers Freizeitschuhe Turnschuhe DELSON - ANTIGO Braun
2019	Nike Air Zoom Terra Kiger 6 ( CJ0219-700 ) Trail Running Schuhe
2020	New Balance Herren Sneaker Schuhe Classic Sportschuhe Leder Schwarz Beige 40-47
2021	Gabor Sneaker 33 334 12 Wehisky natur Braun Nubuk Leder Reißverschluss Einlage
2022	Nike Air Force 1 '07 - Herren Sneaker
2023	MERRELL " VAPOR GLOVE 4 " HERREN SCHUHE LAUFSCHUH BARFUSSSCHUH GR . 44,5 SCHWARZ
2024	Skechers Arch Fit - She 's Effortless Damen Schuhe Sneaker 149411 ( Blau-LBNV )
2025	Original Superga Platform Sneaker Textil Weiß Zebra Neu 39/39 .5
2026	Nike Air VaporMax Flyknit 3 Damenschuhe Neu Gr . 35,5 Special Edition AJ6910-005
2027	Original BMW M Motorsport Schuhe Sneaker PUMA X-Ray black 43 UK 9 80192467745
2028	adidas Country OG 44 44,5 46 46,5 47 48 48,5 S32105 Vintage SL la trAineR rom
2029	SUPERGA - White unisex 2750-Cotu classic sneaker
2030	Seagull Sneakers Turnschuhe Geile Farbe Echtleder Eu :41 made in USA-Ungetragen
2031	Puma Porsche Design Hybrid Runner II ( 339956 01 ) Sneakers Laufschuhe - NEU OVP
2032	TMA 1367 Sportlicher Damen Halbschuh Sneaker Schuhe Leder blau alle Gr . 36-42
2033	Puma Oslo-City PRM Premium Men Sneaker Herren Schuhe shoes Running
2034	New Balance 57/40 m5740ta
2035	Converse Chuck Taylor All Star Lugged Ox Damen Schuhe Sneaker 567680C ( Weiß )
2036	Fila Crosscourt 2 F Low Sneaker in Pelle Bianca Da Uomo 1010276-95T 107804
2037	ASICS Damen Gel Quantum 360 Shift Mittelgrau Laufschuhe Größe 6 US
2038	Converse Chuck Taylor All Star CTAS Ox Damen Sneaker 163308C blau-rot-weiß
2039	Nike Air Jordan 1 High Zoom CMFT Court Purple - EU37 .5 - Neu - Blitzversand
2040	Under Armour Charged Escape 3 Evo Chrm 3024620-001 Herren Sneaker Laufschuhe
2041	LACOSTE POWERCOURT 0121 SMA 7-42SMA0018147 SNEAKER HERRENSCHUHE
2042	Merrell Vapor Glove 3 Luna LTR J003361 Barefoot Sneaker Turnschuhe Schuhe Herren
2043	Adidas ZX 8000 Sneaker Schuhe Turnschuhe Herren Fresh Mint Tea
2044	Nike Air Force 1 Mid Utility Red Mid 07 Lv8 Gr 43 Hightop
2045	Skechers Empire D ´ Lux - LIVELY WIND Damen Sneaker Sportschuhe 12824 Grau
2046	Nike Air Max 1 Premium Just Do it ! Gr . wählbar Neu 875844 008 362R
2047	Mustang Herren Schuhe Sneaker Gr .43 braun NEU
2048	Adidas Lite Race 2.0 Herren Sneakers Sportschuhe Halbschuhe weiß NEU !
2049	ADIDAS MARQUEE BOOST 40-49 NEU 130 € indoor basketball ghost crazylight explosive
2050	Damen Herren Sneakers Sportschuhe Low Basic Turnschuhe Schuhe 901426
2051	Geox Schuhe PONTOISE weiß Damenschuhe Halbschuhe D94FED 085BN C1000 NEU
2052	AIR FORCE 1 '07 Sneaker Damen Herren Sport Freizeitschuhe Joggingschuhe Weiß
2053	Bally Sneaker mit Wolle gefüttert Gr .43 Originalkarton + Staubbeutel-bitte lesen
2054	LOWA Damen Focus GTX LO Ws - Gore-Text Gr . 41,5 ( UK 7,5 ) 26,6 cm Leder Top ! w.NEU
2055	adidas ZX 9000 x Concepts " Boston Marathon " US 10 11 12 | 43 44 45 47 FX9966
2056	NEU Mustang Damenschuhe Sneaker Halbschuhe Schnürschuhe Fashionsneaker Schuhe
2057	ASICS Herren Schuhe Gel Lyte III Hellgrau Captain Blau Größe 8.5 Neu mit Karton
2058	PUMA Rebound Layup SL Sneaker Freizeitschuhe Sportschuhe Turnschuhe 369573
2059	ASICS Damen Gel Nimbus 19 Schwarz Cosmo Rosa Größe 6 US
2060	Adidas Originals Stan Smith Sneaker Schuhe Bounce Suede S82247 Gr . 38-47
2061	POLO RALPH LAUREN HERREN TURNSCHUHE FREIZEITSCHUHE SNEAKER ART. 816702987002
2062	Nike Air Jordan 4 Retro White Oreo | EU 48,5 | Neu & Originalverpackt |
2063	Adidas EQT Support Ultra PK Herren Sneaker Schuhe Boost BB1242
2064	Lacoste Twin Serve 0721 1 SMA Herren White Navy Red Schuhe Sneaker Weiß Blau Rot
2065	Herren Sportschuhe New Balance [ ML515OTX ] Neu
2066	Camper 17408-124 PELOTAS - Herren Schuhe Freizeitschuhe - Cola-Miel
2067	Herren Damen Wanderschuhe Sneaker Trekking Outdoor NEU 19507 Schwarz Rot 36-50
2068	Bundeswehr Sportschuhe Laufschuhe BW Turnschuhe Schuhe Geländeschuhe Schwarz
2069	Adidas Ultraboost 4.0 DNA Schuhe Sneaker Herren NEU EUR GR .44
2070	Damen Licht Tennis Sportschuhe Turnschuhe Freizeitschuhe Atmungsaktive Sneaker
2071	Nike SB Dunk Low Staples Panda Pigeon
2072	Nike Air Max Plus OG Sneaker Freizeitschuhe Laufschuhe Sportschuhe Neu Größe 40
2073	Skechers Mens EQUALIZER 4.0 MYRKO Sneakers Herren Schuhe braun
2074	New Balance ML574MO Mita x Oshman ' s MINT MOJITO 9 UK 43 EUR 9 1/2 US NEW
2075	Mode Freizeit Damen Herren Laufschuhe Turnschuh Sportschuhe Running Sneaker Gym
2076	Schuhe Men Frau Nike Air Force Niedrig 1 07 Weiß Schwarz Sportschuhe ct2302 100
2077	Dachstein Dach-Steiner WMN - Gr 38 - UK 5 - NEU ( 311848-2000-1340 )
2078	ASICS Onitsuka Tiger Mexico 66 Gr . 45 US 11 UK 10 Beige Grass Green Sneaker
2079	Asics Gel-Kayano Trainers Evo Mens Lace Up Shoes Textile Green H621N 8484 B31D
2080	Puma MAPM Drift Cat 7 306150 02 Herren Schuhe Sneaker Freizeitschuhe Schwarz
2081	Adidas ZX 8000 Clear Brown Neu in Box new in box H01399 US 12 UK 11,5 EUR 46 2/3
2082	Neu All Star Converse Chucks Hi Can Sneaker Schuhe Star Player 113827 Gr .36,5
2083	Melvin & Hamilton Herren Design Leder Sneaker Harvey 15 Low Top blau orange
2084	EYTYS LAGUNA ROSEMARY LOW TOP LACE UP SNEAKERS HERREN SCHUHE LAOL
2085	Puma Carina Damen Sneaker | Turnschuh | Sportschuh | Textil , Synthetik - NEU
2086	Asics Herren Sneaker Tiger Runner 1201A093
2087	Nike Air Max 90 Essential ID Gr .45 DJ2774 991 schwarz Sneaker Herren Classic Neu
2088	Hummel Unisex Sneaker Stadil Low Balistic 3.0 208373
2089	Reebok x Billionaire Boys Club Zig Kinetica US 10,5 EU 44,5 BBC RBK Glow In Dark
2090	Tommy Hilfiger WMN Classic Sneaker
2091	Womens NIKE Blazer Mid Suede Vintage Neu ROT Gr :44,5 Wildleder Sneaker Retro
2092	Damen - Sneaker - Sportschuh - FILA - rosa - Gr . 39 - #O 2
2093	Floris van Bommel Schnürschuh grau blau 18302 / 06
2094	Jomos Campus 322410 , extra weite Herrenschuhe aus Leder * Übergröße *
2095	VANS Schuhe Freizeitschuhe Ward Sneaker Veloursleder Sport Halbschuhe uni 36894
2096	Nike Venture Runner Herren Sneaker Schwarz CK2944-002 Retro Schuhe Turnschuh NEU
2097	ADIDAS Strutter Herren Schuhe Sneaker Training Freizeit Indoor EG6214 / O4
2098	Spiral High Top Sneakers - Flaming Spine
2099	Tamaris Schnürschuhe Sneakers Halbschuhe rose NEU !
2100	Skechers Sneaker BOUNDER VOLTIS Herrenschuhe Übergrößen Blau
2101	Gabor Sneaker " Gitte " puder kombiniert Weite H Gr . 35,5 37 38 38,5 40 44
2102	Asics Sneaker Onitsuka Tiger Fabre 74 Gr 36,5 Retro Weiss Grün HN846-0101
2103	Schuhe-Trentasette Damen Sneaker Low-Cut weiß
2104	Reebok x BBC - Billionaire Boys Club - Ice Cream - Iverson Answer V Mu - FW7506
2105	Nike Air Max 97 Gr .42 Sneaker Schuhe Running grau CI6392 001 Herren Sport
2106	Timberland Jackson 's Landing HS Camp Moc Herren Chukkas | Boots | Leder , Textil
