Record Number	Title
353	Herren Sport Schuhe Audi RS Bestickt Shoes Motor Sport Gr . 40-45 , Sneakers
354	New Balance Damen Schuhe Sneaker Turnschuhe Freizeitschuhe WL574EN ( Blau )
355	adidas NMD XR1 Originals Primeknit " Zebra " Sneaker Runner Boost BB2911
356	NIKE Air Jordan Retro 10 Neu Pure Platinum Gr :40 US :7 retro kobe premium shoes
357	New Balance 373 Unisex Athletik Turnschuhe In Jeder Farbe EU Grobe 36 - 48
358	Geox Damen Sneaker Sukie D04F2A 00085 C1000 Weiß Gr .37
359	Asics - Gel-Nandi 360 White / Marigold Orange Sneaker Sportschuhe
360	adidas Glenbuck SPZL 40 41 42 43 44 45 46 DA8758 80 's Spezial nEw yOrK sL
361	Nike Air Jordan 4 Retro Lightning 44 US 10 NEU
362	Hummel 63511 6453 Slimmer Stadil High Olive Night grün MID Canvas NEU SALE
363	Herren Sportschuhe Sneaker Turnschuhe Schuhe Runners Gr .41 - 46 Art.-Nr . 1998
364	Puma Mantra FUSEFIT Herren Schuhe Sneaker Running Fitness Turnschuhe 191427 03
365	Nike Dunk Low Off-White University Red USED COND :9 / 10 SIZE : US10 ,5 / EU44 ,5 / UK9 ,5
366	Reebok Royal Mid SE brass / black / chalk Sneaker / Schuhe
367	Original Nike Tanjun Gr . 41 / US 8 / 26 cm - Nike # 812654-011 black white
368	EU Größe 44 - adidas Yeezy Boost 350 V2 mit Karton + Rechnung
369	High Top Sneaker Gr.36-41 Neu Turnschuhe Freizeit Schuhe Halbschuhe Knöchel 2549
370	Adidas Grand Court Base EE7901 Herren Sportschuhe Sneaker
371	Waldläufer Damen Sneaker SUN Größe 38 38,5 39 923011 148 209 Leder lose Einlage
372	Dockers Damen Schuhe Sneaker Turnschuhe 42BM218-610 ( hellblau 610 )
373	Nike Air Jordan 3 Retro 136064120 Herren Basketball Schuhe Gr . 45 / 11 *
374	Nike Air Jordan 1 Mid Light Smoke Grey ( W ) | BQ6472-015 | Neu inkl . Box
375	Adidas NMD CS1 PK Primeknit Sneaker Turnschuhe AC8597 blau Gr . 36,5 - 44,5 NEU
376	Airwalk Barcares Navy Freizeitschuh 289980-61
377	Adidas Top Ten " Made in Spain " Vintage Sammler 80er x602
378	ASCIS HERREN TURNSCHUHE FREIZEITSCHUHE SNEAKER GRAU HELLMINZE H6E2N GEL-LYTE EVO
379	Adidas Speedfactory AM4 AM4SH Shanghai CG6785 Sneaker Herren Schuhe Herrenschuhe
380	Keen Damen Sneaker Explore WP 1023457 Dusty Olive Drizzle
381	Puma Trinomic R 698 " PERF Pack " 44.5 Black / White
382	SUPERGA Sneaker Schuhe 2750 COTU CLASSIC Schuh 2021 sunflower Freizeit
383	Herren Sneaker Salomon Speedcross 3 Outdoor Schuhe Laufschuhe
384	LIDL Sneaker Herren Größe 41 - 46 Livergy limitiert Fan Kollektion NEU & OVP
385	MUSTANG SHOES Damen 1313-303-18 Sneaker Halbschuhe Schnürsenkel Weiß Blau
386	PUMA City Rider B&W Sneaker Unisex Schuhe Neu
387	Nike Air Max 1 G grau / schwarz / rot Golfschuhe Größe 46 / 12 Neu mit Karton
388	Onitsuka Tiger Sneaker Herren GSM 1183A515-100 White
389	Sportschuhe Turnschuhe Mehrfarbig Gr 36 37 38 39 40 41 42 43 44
390	Nike Dunk Low Easter 2022 ( W ) verschiedene Größen / NEU | OVP | RECHNUNG
391	Herren Sportschuhe NIKE ULTRABEST REPOSTO MEN 'S 101588 Schwarz
392	Herren Damen High Top Sneakers Sportschuhe Stoffschuhe Freizeit 815564 Schuhe
393	Adidas Fechtschuhe Turnschuhe Trainers Gr ( 7 ) 40,5 70er West-Germany
394	Rieker Damen Sneaker Lederimitat Textil Schnürung leicht flexibel Ziernähte
395	New Balance WL574SLP weiß / gold , Damen Sneaker , NEU im Karton
396	Nike Roshe Two Hi Flyknit Rot WMNS Gr . 38,39,40 NEU Winterstiefel
397	Skechers Sport Womens ARCH FIT BIG APPEAL Sneakers Women Grau
398	Etnies - Fader Sneaker Herren Skate Brown Black Grey Dirty Wash Skateschuh
399	ANDREA CONTI DAMEN SCHUHE FREIZEITSCHUHE SCHNÜSCHUHE SNEAKER WEISS NEU
400	NEU SKECHERS Herren Sportschuhe Sneakers Turnschuhe ELITE FLEX-FALCONHOLT Weiß
401	Puma VISTA JR Damen Kinder Unisex Sneaker Schuhe Retro 369539 Elderberry
402	Stoff Sportschuhe All Star Chucks Sneaker 39 Sammler Gerne Getragen Liebhaber
403	Wanderschuhe Salomon XA Pro 3D gr 45 1/3
404	Puma Herren X-Ray Sneaker Turnschuh 372602
405	New Balance ML515CT3 Classic Herren Sneaker Sportschuhe NEU
406	KAMO GUTSU Schnürer Leder-Sneaker - Pino-Curcuma - Made in Italy - Neu & OVP !
407	39-47 Herrenschuhe Trekking Sneaker Boots High Top Schnürer Rutschfest Outdoor D
408	PUMA Legende Unisex Speed Cat Speedcat OG Sparco Sneaker Low Top Rot 339844
409	Asics Tiger Hyper Gel Lyte Black Black 1191A011-001 Sneaker Shoes Schuhe Men
410	40-46 Salomon Größe Speedcross 3 Herrenschuhe Sportschuhe Turnschuhe Laufschuhe
411	PUMA X-Ray 2 Square Sneaker Männer Schuhe Basics Neu
412	PUMA x Les Benjamins CELL Ultra Fade OG Alien Sneaker Mode Schuhe mehrfarbig neu
413	Damen Kinder Herren Sneakers High Top Sportschuhe Schnürer 897467 Schuhe
414	Nike Air Shake Ndestrukt / Pigalle AA4315 100 US_9 / 9.5 / 10 EUR_41 / 42/42 .5 / 43/44
415	New Balance PROCTCAB schwarz / grau , Herren Sneaker , NEU im Karton
416	British Knights Dee Damen Sneaker | Turnschuh | Sportschuh - NEU
417	Reebok Classic Leather Damen Sneaker low Turnschuhe Sportschuhe Freizeitschuhe
418	Converse Chuck Hi UK Flag DISTRESSED 135504C - unisex -
419	Asics Gel-Lyte III india ink Schuhe Sneaker Runner Gel Sohle weiß H6X2L 5050
420	Narut0 AKATSUKI Anime Sneaker Freizeitschuhe Sportschuhe Schnürer Schuhe Shoes
421	Adidas Originals Trefoil Shoes Shoes Sneakers Shoe Schuhe SuperCourt BF Herren
422	New Balance Sneaker Damen WL373FT2 Black / White Schwarz
423	Keen Glenhaven Explorer Sneaker Herren Schuhe Halbschuhe Schnürschuhe NEU
424	Levi ' s Damen Sneaker Schuhe Damenschuhe Turnschuhe Damensneaker Leder Mullet
425	FILA Damen Sneaker Schuhe Schnürschuhe Mehrfarbig 1062 Gr.36-40 Neu mit OVP
426	adidas Crazylight Boost Low Herren Sport Schuhe Sneaker Basketball Orange 2014
427	Adidas Damen Sneaker Retrorun EH1859 Running Shoes Freizeit Schuhe Schwarz
428	New Balance Retro 530 Silber SG Paar Laufschuhe Sportschuhe atmungsaktiv Schuh
429	Puma Tsugi Blaze Trapstar Leather Trainers 364713-01 Black / White UK8 / US9 / EU42
430	Fila Sneaker 37 Rot Schuhe Top Zustand
431	New Balance Ganni 2002r EU 43 | US 9,5 Rain Cloud Island Green NEU
432	Nike Air Force 1 Shadow | Pastell Barely Green | 36,5 | Pastell Grün
433	BK British Knights Sneaker Schuhe Atoll grey dk-pink NEU Größe wählbar
434	Nike Downshifter 10 Herren Laufschuhe Sportschuhe Traning CI9981-006
435	892730 Tolle Schnürer Damen Schuhe Sneaker
436	Asics Gel Kayano Schuhe Freizeit Sport Sneaker Unisex Turnschuhe Laufschuhe
437	prada sneaker 38
438	adidas ZX Flux XENO Frozen Yellow ( 2015 ) EU 42 2/3 44 | US 9 10 AQ8212
439	Nike Air Force 1 Low | Rattan Beige Mini Gold Swoosh | Weiß Gold
440	Adidas Ultraboost 3.0 Triple White BA8841 - Gr . 44 2/3 ( UK 10 ) , Weiß / Weiß
441	Adidas NMD_R1 schwarz Damen Low-Top Sneakers Canvas Running Boost PrimeKnit NEU
442	Damen Sportschuhe Slip Ons Strick Sockenschuhe Fitness Sneaker 830008 Schuhe
443	K-Swiss Dani Damen-Sneaker Turnschuhe Freizeitschuhe Halbschuhe Schuhe NEU
444	Puma SF Ferrari Drift Cat 5 Ultra 305921 02 Herren Schuhe Schwarz Sneaker Rot
445	Rennfahrer Herrenschuhe 36-46 Fahrrad Sneaker Athletik Spikes Deckschuhe Fashion
446	Converse Chuck Taylor All Star Damen Sneaker Schuhe CTAS OX 152705C gelb
447	asics gel lyte III 39 37,5 40 H6W7N 4747 sAgA gT II footpatrol IV V cockatoo
448	Nike Air Max 97 German Camo Germany AJ2614204 ( Größe 38-46 )
449	Vans Atwood Herren Sneaker Schnürschuhe Halbschuhe Freizeitschuhe Schuhe blau
450	MERRELL Vapor Glove 3 Luna LTR J97177 Barefoot Sneaker Turnschuhe Schuhe Herren
451	B6792 sneaker uomo DIADORA HERITAGE TRIDENT S SW scarpa grigio / blu shoe man
452	KangaROOS KL-Callao Herren Sneaker Low Halbschuh Sportschuh Freizeitschuh Mesh
453	Tamaris Damen Sneaker low Schnürschuhe Halbschuhe Sportschuhe Lederschuh Schuhe
454	DAMEN HERREN UNISEX SCHUHE SNEAKERS CONVERSE ALL STAR OX [ M5039 ]
455	Marco Tozzi Schnürschuhe Sneakers Halbschuhe weiß 23743 NEU !
456	Converse Chuck Taylor All Star Unisex Sneaker Schuhe Run Hike Smoked 168298C
457	Puma ST Activate Winterschuhe Stiefel Erwachsene dunkelgrün
458	Damen Plateau Sneaker Gefütterte Freizeit Turnschuhe Zipper 832310 Schuhe
459	Skechers Sport Womens FLEX APPEAL 3.0 MOVING FAST Sneakers Women Grau
460	Nike Air Max 90 White / White-New Maroon-Black Gr .42 / 43/45/46
461	Sport Schuhe Sneakers Unisex Nike COURT BOROUGH Haut LOW 2 Schwarz
462	Neu All Star Converse Chucks low Sneaker OX Eyelet 542541c Gr .37 UK 4,5
463	Herren Damen Sneaker Flach Sportschuhe Turnschuhe Atmungsaktiv Schuhe Gr . 39-43
464	Herren Sportschuhe Slip Ons Sportliche Strick Profil-Sohle 838851 Schuhe
465	adidas Terrex Free Hiker Parley W Wanderschuhe Trailrunning Damen ( EF2344 ) NEU
466	New Balance ML850SBC weiß / grau / schwarz , Herren Sneaker , NEU im Karton
467	Asics Onitsuka Tiger Mexico 66 Retro Sneaker Herren Freizeitschuhe D832L-9096
468	Superga Lady Shoes Woman 2790ACOTW LINEA UP AND DOWN Traveling Wedge
469	Schuhe Asics Onitsuka tiger mexico 66 D5V1L D2J4L Mann Frau Kork Mexiko
470	K-Swiss Court Shield Damen Schuhe Sneaker Turnschuhe 96599 ( Schwarz 044 )
471	Puma Unisex Sneaker Caven 380810
472	Damen Schuhe SCARPA Mojito aloe grün Outdoorschuhe Multisport Freizeit
473	Converse C Taylor All Star HIKER BOOTS HI Chuck Sneaker Leder gefüttert 162479C
474	Prada Iconic Cult NEVADA Mens Trainers Sneakers Shoes Schuhe Turnschuhe Neu 43
475	Adidas Questar Gr 46 UK 11 Originals ZX 116748 Cushion 2005 Torsion EQT Support
476	Adidas Originals ZX Flux Techfit Sneaker Damen Schuhe Turnschuhe schwarz S75488
477	Nike Air Max Bolt Herren Sneaker CU4151 002
478	Nike Air Max Command Leder , Sneaker , LTD , Classic , Sportschuhe , 749760 / L3
479	DSTREET Sportschuhe Sneaker Turnschuhe Schwarz Weiß Freizeit Sport Herren 40-44
480	Nike Air Jordan 1 Mid Chicago Toe ( 554724-069 ) neu Größe 44
481	Converse Chuck Taylor All Star Ox 167636C Black / Total Orange / Street Sage
482	adidas 90s Valasion Sneaker Turnschuhe Freizeitschuhe Sport EG2882 Gr . 41 1/3
483	Herren Damenschuhe Turnschuhe Laufschuhe Atmungsaktiv Running Shoes Gr.36-44
484	DC SHOES TONIK 302905 SCHWARZ SKATESCHUHE SNEAKER EU GR . 39 - 46 ( UK GR . 6 - 11 )
485	Herren Atmungsaktive Sneaker Draussen Sport Freizeit Laufen Tennis Schuhe Leicht
486	Puma Axelion LS Herren Sneaker | Turnschuh | Sportschuh | Textil - NEU
487	Gabor Schuhe Freizeitschuhe Sneaker Lederkombination Sport Halbschuhe uni 15420
488	adidas Originals Stan Smith Jelly Damen Sneaker transparent FW9930 Neon Orange
489	adidas Breaknet Sneaker Damen - weiß / pink
490	jordan 1 mid schwarz weiß
491	Art 262 Blue Klett Schuhe Sneaker Sportschuhe Damen Herren
492	ADIDAS SL 80 Sneakers Turnschuhe Old School Schuhe Retro Gr 37 Laufschuhe S15
493	Neu Freyling Ultra Soft Frey-Blast Sneaker Low 17849735 für Herren grau
494	adidas Originals Schuh EQUIPMENT EQT ADV BZ0000 Energy Aqua NEU Gr .38 REDUZIERT !
495	CONVERSE All Star Chucks 70 'S OX SUEDE Leather pumpkin egret 166217C NEU
496	Diadora - Sneakers MI BASKET LOW USED für mann und frau
497	Chekich Sneakers | Herren und Damen Schuhe | Turnschuhe | Sportschuhe
498	Romika Sportschuhe Tennis Master 220 marine Herrenschuhe Übergrößen Blau
499	adidas Puremotion
500	Fila Sneaker , 41 , blau ,
501	New Balance WL574EB
502	Originals Adidas MARATHON Trainer Gr .46,5 Schwarz Retro Vintage RAR Kult 90er
503	Neu Schuhe PUMA SHUFFLE PERF Herren Sneaker Turnschuhe Freizeit Sportschuh TOP
504	adidas Superstar 80s DLX 47 49 B25964 rom cAmPuS sTan smitH forUm dEcadE 80 's
505	New Balance MS009HD1 Sneaker Herren Größe 44
506	Vivobarefoot Gobi II M Gr . 44 schwarz
507	Nike WMNS SHOX ENIGMA Herren Schuhe Turnschuhe ( BQ9001 003 ) Top Deal
508	Lässige Napapijri Sneaker Gr . 39 weiß silber bronze
509	Adidas Lite Racer CLN WMNS Sneaker Halbschuhe Turnschuhe Freizeit Sport Damen
510	Nike crater impact DB 2477001NEU Gr44 Uk9 Us10 Cm28
511	Herrenschuhe Outdoor Athletic Rutschfestes Jogging Gehen Laufen Tennis Sneakers
512	NEU * REEBOK PUMP HEXALITE AEROBIC LITE MID * CASUAL VINTAGE * ZX 8000 * RAP * GR : 42 * NEU
513	Asics " ONITSUKA TIGER " Colorado Eighty Five
514	Damen Plateau Sneaker Keilabsatz Schnürer Profil-Sohle Schuhe 836492 Trendy Neu
515	adidas Originals Superstar CM8081 Leder Turnschuhe Fashion Sneaker Weiß Grün
516	Tommy Jeans Heritage Runner Sneaker Schuhe Herren Weiß EM0EM00397 YBS
517	Geox Schuhe SNAKE 2 blau Herrenschuhe Sneakers U948DA 022FU C4K9M NEU
518	Neu TOMMY JEANS Sneakers Low 10490508 für Damen dunkelblau
519	SALOMON X-SCREAM LT Light Weight Muscle * Gr . 37/38 Gr . 5 * Zip-Verschluss * w.NEU
520	adidas Originals Superstar Sneaker Weiss Schwarz
521	New Balance Pro Court Cup AB Black Grey Herren Schuhe Sneaker Schwarz Grau
522	Louis Vuitton Hi Top Weiß Sneaker Gr . 45
523	Asics Japan S 1193A158-100
524	Puma Streetballer Mid Winter Leder burnt olive Schuhe grün 358798 03
525	Puma Escaper Mesh Sneaker Turnschuhe Sportschuhe Laufschuhe 364307 01 Gr . 37.5
526	Adidas EQT Equipment Support 91/18 Sneaker Turnschuhe Schuhe B37521 Gr . 37 NEU
527	ADIDAS Hard Court / High Top - Gr . 45 - viel getragen - USED - Liebhaberstücke
528	Adidas Originals Superstar Foundation Schuhe Sneaker Unisex B27140 Schwarz
529	K-Swiss Lozan Klub LTH Herren Leder Sneaker Turnschuhe Sport Freizeit Schuhe NEU
530	Puma Amp XT WNs Damen Sneaker Laufschuh Fitness schwarz 191125 05
531	Nike Sneaker Revolution 5 Blau Ozean Textil Mesh BQ3204 012 Schnürung Halbschuh
532	Damen Sport Schuh Netzmuster Sneakers Lack-Optik Halbschuhe Schnürer EVA-Sohle
533	Vans Era 59 Gr . wählbar Neu & OVP 45-20972-8-04
534	Puma Trinomic XS850 X BWGH
535	Nike Air Force 1 Weiß / Schwarz Damenschuh Herrenschuh CT3839-100
536	Skechers Go Walk 3 Revive
537	Skechers Herren Gowalk 5 Apprize Ultra Go Max Laufen / Wanderschuhe Schwarz
538	Adidas Racer Lite Damen Sneaker navy camouflage
539	Puma Shuffle Herren Schuhe Sneaker Turnschuhe 309668 ( Schwarz 04 )
540	Sportliche Damen Sneakers Halbschuhe Turnschuhe Gr .36 - 41 Neu Schwarz A. 613
541	adidas Superstar 80 's 44 44,5 45 46 47 48 49 G61070 campus top ten sTan smitH
542	SPRINGFIELD Sneaker Turn / Laufschuhe rot / grün / blau EUR 38 ; US 7,5 245mm Neu
543	adidas Alphabounce RC W , EQT Racing 91 W , Tubular Doom Primeknit M , EUR 36 - 47 1/3
544	Asics Frequent Trail 1011A034-001
545	Nike Tn / Air Max Plus 3 ltr gr . 42,5 US 9 UK 8 used gebraucht
546	Sneaker Le Coq Sportif Größe :40 -45 Weiß UNISEX Schuhe Sport Straßenschuhe
547	Adidas ZX 8000 Atmos G-SNK 4 , ( Germany ) , EU 45 1/3 , US 11 , BNIBWT , GX7842 , Neu
548	High Top Basketballschuhe Schuhe Sneaker Skater Skaterschuhe Neu Herren 004
549	Tommy Hilfiger Damen Sneaker Schuhe FW0FW02349 weiß Gr . 36 37 38 39 40 41
550	Herren Sneaker Trekkingschuhe Outdoor Wanderschuhe Freizeitschuhe 52656
551	Herren Schuhe adidas TERREX SKYCHASER LT F36101
552	Nike Air Max 270 React W GS Sneaker Damen CT6661-001 Gr 38,5 Silber grau NEU
553	Converse Chucks Plateau Schwarz 560845C Chuck Taylor All Star Lift - HI Black W
554	Damen Skechers Memory Foam Turnschuhe Freizeit Gipfel Schnell Lapse
555	Converse Chucks Low CT AS OX 157667C Schwarz Black
556	SALOMON GORE-TEX Schuhe Gr . 46 2/3 UK 11.5 Sportschuhe Trekking / Wanderschuhe
557	WMNS Nike Air Max Fusion Gr . wählbar Neu & OVP CJ1671 002
558	NEU Skechers Damenschuhe Schuhe Sportschuhe D ´ Lite Sneaker Halbschuhe Schnürer
559	GANT Saint-Bro Herren Sneaker Turnschuhe Sportliche Schnür Halbschuhe Blau Leder
560	Skechers GOrun 600 - Refine Herren Schuhe Sneaker Turnschuhe 55061 ( Grau-CCBL )
561	Nike Air Max Tailwind V x Skepta * Chrome Blue * | EU42 | US8 ,5 | Brandneu
562	Puma Training und Freizeit Vikky Stacked SD Damen schwarz weiß
563	Nike Air VaporMax 2021 FK FlyKnit DH4086-001 Herren Sneaker Schwarz Sport Schuhe
564	NIKE JORDAN ZOOM 92 CK9183 101 SNEAKER HERRENSCHUHE
565	adidas T-MAC Millenium Boost - Tracy McGrady - G26951 Herren Basketballschuhe
566	Puma Speedcat Mid SPARCO Herren Sneaker 306609-02 Motorsport Schuhe Gray NEU
567	ADIDAS Terrex Folgian Hiker GTX , Herren , Schuhe , Trekking , Wandern , FW8688 / M3
568	K-Swiss Surf 'n Turf OG 50TH Men Sneaker Turnschuh weiss Herrenschuh Gr . 41
569	Warm Gefütterte Damen Sneakers Turnschuhe Kunstfell Winter Schuhe 902168 Mode
570	adidas GRAND COURT Turnschuhe Freizeitschuhe Herren GY3625
571	Herren Slip-On Laufen Freizeitschuhe Outdoor-Tennis-Walking-Sport-Turnschuhe
572	Vivobarefoot Jing Jing - Damen Minimalistishe Barfuß Ballerina Laufschuhe
573	Adidas Samba Wales Bonner Sneaker Turnschuhe Schuhe beige FX7720 Gr . 38 2/3 NEU
574	New Balance CM996 Multicolor Herren Sneaker Freizeitschuhe Turnschuhe
575	UGG Highland Damen Sneaker
576	Asics GEL-LYTE III OG Sneaker Herren Lauf Sport Schuhe Turnschuhe Running Gr .45
577	Diesel Laika Persis W Mid Leopard Print Damen Sneaker Trainers Shoes Schuhe
578	Nike Jordan React Havoc Sneaker Schuhe Schwarz Herren AR8815 001
579	Ecco Soft 20 Damen Sneaker 206503-01303
580	adidas James Harden Vol . 1 PK Primeknit Herren Basketballschuh AP9840 Sportschuh
581	adidas Originals Yung-1 Sneaker Damen Herren Schuhe Turnschuhe B37616 weiß neu
582	MUSTANG Herren Schnürer High-Top-Sneaker 4095-602-820 C28
583	adidas Originals Tubular Doom Mid Schuhe Herren Sneaker BY3553 Winter Weiss
584	RIEKER Schuhe Schnürschuh 52540-14 blau NEU
585	Adidas Superstar sneakers Schuh e weiss schwarz Gr . 36 38 42 43 44 45 46 48 49
586	Air Jordan 1 Mid Herren Sneaker Rot Leder Freizeitschuhe Sportschuhe
587	Converse Chucks All Star OX Größe 40 MAROON WEINROT M9691C NEU TOP
588	Skechers OG 85 Damen Sneaker Schnürschuh Beige 111-TPE
589	Converse Hello Kitty Sanrio Chuck Taylor All Star Hi 164629C Turnschuhe Chucks
590	ASICS x DISNEY Gel Lyte III " Beauty And The Beast " US 7.5 / EUR 39 / NEU OVP
591	SKECHERS , Equalizer Sneaker , Herrenschuh Sportschuh , SONDERPREIS , Gr . 40
592	Herren Sneaker Sportschuhe Turnschuhe Laufschuhe Schnürschuhe Running Boots DE
593	Nike Waffle Racer Gr . wählbar Neu & OVP CN8116 800 322R
594	Air Jordan 4s military blue Herren Größe 43 ( * neu mit Karton ) UK 8.5 US 9.5
595	NEU SKECHERS Damen Sneakers YOU RADIATE
596	Lacoste Straightset INSULAC3181CAM Herren Sneaker Schuhe Leather / Textile braun
597	NEU SKECHERS Damen Sneakers Kaltwetterstiefel Boots ON-THE-GO JOY LUSH Braun
598	ADIDAS ORIGINALS ZX 8000 ( EF4364 ) Sneaker Trainers Grau Weiß - NEU
599	adidas Cloudfoam ChazyChaos Sneaker EF1054 weiß-grau EU 42 2/3 UK 8,5
600	Herren Sportschuhe Sneaker Turnschuhe Laufschuhe Freizeitschuhe Große Gr.39-46
601	DOC DR. MARTENS " SNEAKER " 3A58 RED
602	Puma CARINA L Jr Damen Mädchen Streetstyle Sneaker Sportschuhe Freizeitschuhe
603	Nike Air Max 1 " Attack Pack " Sport Red
604	** ADIDAS HERREN SNEAKER MALE GR . 43 1/2 **
605	FILA Venom V94M Low Herren Sneaker 1010572.20 Z Schuhe Retro Turnschuhe NEU
606	SKECHERS " ARCH FIT S-MILES MILE MAKERS " DAMEN TURNSCHUHE SNEAKER GR . 36 WEISS
607	Schuhe FILA Gr . 42 NEU OP 44,99 € Sneaker
608	Puma Unisex Schuhe Sneaker Kreta 349240 09 Teak Chocolate Brown braun
609	KUSTOM SNEAKER CIARA DENIM
610	Adidas Sneakers Shoes Trainers Schuhe predator trainer 20.1 Weiß Herren
611	Naturläufer Sneaker schwarz Gr . 39 H , wie NEU , Leder Schnürschuh
612	Basketballschuhe Gr . 44,5 K1X Anti Gravity mid-cut Sneakers , blau hellblau cyan
613	Converse CTAS OX Chuck Schuhe Textil Sneaker Orange Rind 164937C
614	Original DDR Tramper Brombeer / Rot Klettis Blueser Schuhe Kletterschuhe Gr.38-47
615	Diadora x Lc23 N9000 Socks Terra SATURNO WILD DOVE NEU OVP UK10 44,5 MEGA !!!
616	TOMMY HILFIGER Damen Schuhe Customize Flatform Sneaker blau blue Leder Gr 41
617	Timberland Skape Park Boat Canvas Bootsschuh Sneaker Schuhe Grau Grün Herren Men
618	Pantofola d‘Oro Herren Leder Sneaker , Größe 43 , braun blau gebr . Top Zustand
619	Nike Zoom Freak 1 Basketballschuhe Neu Gr . 43 ( BQ5422-004 ) Giannis Antetokounmpo
620	Herren Sneaker Knöchelschuhe NEU High Top Basketballschuhe Sneaker Gr.41-46 2627
621	Puma Vikky Damen Schuhe Sneaker Turnschuhe 362624 ( Dusty Coral-White 30 )
622	Veja - V-10 Extra White / Jaune Fluo Halbschuhe Schuhe
623	ORIGINAL ADIDAS FOREST GROVE J DAMEN EG8958 TURNSCHUHE SNEAKER FITNESS SCHWARZ
624	Brütting Diamond Classic V Erwachsenen Sportschuhe
625	Herren Laufschuhe Stricken Atmungsaktiv Sportschuhe Sneaker Turnschuhe Freizeit
626	Ganter Damen Sneaker Freizeitschuhe Halbschuhe Slip On Comfort Grau Gr . 41 ( UK7 )
627	Eleven Paris Bascan Schuh navy wash
628	Nike Air Jordan 1 Mid GS Sonics Sneaker | 554725-371 | Verschiedene Größen ✅
629	Nike Damen WMNS Atsuma Weißer Syntetik / Textil Sneaker
630	Puma Flyer Runner Damen Laufschuhe , Peach / White , Gr , 37,5-42
631	Mizuno Wave Prophecy 8 Schwarz / Schwarz / Drkshadow Herren J1GC190010
632	Nike Sneaker Gr 39
633	adidas UNIVERSAL Schuhe Sneaker Sport Weiß vintage rar Gr . 41 1/3
634	10 Paar Zweigut ® Schuhe B - Ware da teilweise einmal getragen mit kleinen Fehlern
635	Skechers Sneaker Low Equalizer 3.0 Charcoal / Schwarz Textil Normal Herren
636	Brooks Ghost 13 Goretex Herren Laufschuhe Schwarz Atmungsaktiv Sneakers
637	Emerica Originals " Marc Johnson " Re-Release Größe 42
638	New Balance 574 Sneaker low Halbschuh Schnürschuhe Schuhe Leder Mesh Gummisohle
639	Puma Smash v2 Sportschuhe in Übergrößen Blau 364989 04 große Herrenschuhe
640	adidas micropacer Größe US 11,5 weiß
641	PUMA R78 Sneaker Herren Freizeitschuhe Turnschuhe Sportschuhe Retro 373117
642	LICO Freizeit Trekking Wandern " SIERRA " schwarz / lemon Gr . 40 - 47
643	NEW LV Louis Vuitton x Virgil Abloh x Nike Airforce AirForce 1 9.5
644	Asics Herren Gel-Venture 8 Trail Turnschuhe Laufschuhe Sneaker Blau
645	Herrenschuhe Running Freizeitschuhe Sneaker Sportschuhe Turnschuhe Laufschuhe DE
646	New Balance NB M 991 MSU - US 12 - EUR 46,5 - TOP - unbenutzt ! NEU in bordeaux !
647	Tommy Hilfiger Lightweight Corporate Herren Sneaker Blau FM0FM02661-DW5 Schuhe
648	892945 Damen Plateau Sneaker Schnürer Stoffschuhe Sneakers Schuhe
649	Nike Air Penny 3 III Foamposite Jordan
650	Art 332 Sneaker Turnschuhe Schuhe Sportschuhe Neu Damen
651	Skechers Empire - Sharp Thinking Damen Sneaker Schuhe 12418 ( Schwarz / Grau-BKCC )
652	adidas X UNDEFEATED GSG9 Sneaker OliCar / LGrey / Orange G26650
653	Reebok Pump Supreme CN1236 Herren Damen Sport Sneaker Schuhe Unisex Laufschuhe
654	PUMA Carina 368879 Damen Sneaker Turnschuhe Knöchel Freizeitschuhe Mehrfarbig
655	Converse Chucks Chuck Taylor All Star Dainty New Comfort Damen-Sneaker Schwarz
656	Neuwertiger YOUR TURN Sneaker Winter , Herbst Schuhe , Boots Sport Schnürer Gr . 44
657	adidas Turnschuhe NMD R2 PK Schuh CQ2400 Core Black White Prime Knit reduziert !!
658	Damenschuhe Sneaker Sportschuhe Turnschuhe Laufschuhe Blau Fuchsia Neu
659	Nike Air Jordan Mars 270 Basketballschuhe Neu Gr . 44,5 ( CD7070-100 )
660	Gabor Sneaker Gr 39 Weiss Wie Neu
661	Fila Amore Damen Pink White Leder & Textil Sneaker Mode
662	Fila Disruptor II Patches White Leather Lace Up Womens Trainers 5FM00538 100
663	Adidas NMD Racer PK Primknit Damen Sneaker Turnschuhe blau CQ2032 Gr 36 - 38 NEU
664	Adidas NMD R1 Sneaker Turnschuhe Schuhe Goodbye schwarz FV8732 Gr . 36 - 47 NEU
665	adidas originals NMD_R1W Boost Freizeitschuhe BB6367 Sneaker purple dunkellila
666	Nike Air Max Axis ( W ) Damen Sneaker Weiß AA2168-100 Sport Fitness Freizeit Schuh
667	Converse Chuck Taylor All Star Unisex Sneaker Schuhe Distressed Low Grün 169779c
668	Asics Gel Lyte III Herren Sportschuhe Sneaker EUR 42 1/2 Nr . 1-R-725
669	Neu SKECHERS Flex Appeal 4.0 Fresh Move Sneakers Low 20932230 für Damen
670	Nike Air Jordan 1 Mid White Racer Blue ( GS ) | NEU ✅ | OVP ✅ | GEWERBLICH ✅ |
671	Nike MD Runner 2 ( 749794-010 )
672	Turnschuhe Hallenschuhe Sportschuhe Sneaker Schwarz Blau 18533 Neu 36-46
673	Puma Trinomic XT-1 + Wn 's capri breeze Schuhe Größenauswahl
674	adidas FOREST HILLS Schuhe
675	NEU SKECHERS Damen Sneakers Turnschuhe Walking Slip On YOU DEFINE Pink
676	Jomos 315201 , leichter , komfortabler Schnürschuh ** Übergröße **
677	Giesswein Merino Runners , 41 , blau , Herrensneaker , 1A Zustand !
678	NEU SKECHERS Damen Sneakers GO WALK LITE-SPARKLES Halbschuhe Ballerinas Slipper
679	FILA Sneakers Damen Freizeitschuhe Turnschuhe Gr . DE 37 Kunstleder gelb #dce 5497
680	Waldläufer , Damen Gesundheit Schuhe - Bequem Schuh , Olivengrün / Braun
681	Asics Herren Gel-Venture 8 Trail Turnschuhe Laufschuhe Sneaker Grün
682	REEBOK SnEakErs PINK ähnlich ChUcKs ScHuH Stiefel Damen Gr . 36 37 38 39 40 41 42
683	SKECHERS Glide-Step Fasten Up 232136 / NVBK Herren Sneaker Sportschuhe Laufschuhe
684	Columbia Redmond III BM0169033 Wasserdichte Wanderschuhe Turnschuhe Herren
685	New Balance Herren Fresh Foam Hierro v6 Trail Turnschuhe Laufschuhe Sneaker
686	Candice Cooper Rock Strap 01 tortora ( taupe ) Tamponato ( Kalbleder ) Base bianco
687	Ecco Soft 7 Damen Sneaker 43000301708
688	adidas Originals ZX 8000 Aqua Herren Sneaker , Sportschuhe , Turnschuhe , Gr . 40
689	Nike SB Charge Canvas Sneaker CD6279-002 Schuhe Turnschuhe SALE Schwarz Weiß
690	NIKE FRee RN Running 2017 Neu Gunsmoke Grau Neu Gr .36 US :5,5 presto moire
691	Waldläufer Damenschuhe Mokassins Sneaker Slipper Grau Leder Weite H Neu
692	Nike Downshifter 10 CI9981-002
693	CITY WALK SNEAKER GR .37,39,40 NEU DAMENSCHUHE SCHNÜRER HALBSCHUHE
694	New Balance MS237SA grau / hellblau / dunkelblau , Herren Sneaker , NEU im Karton
695	Damen Plateau Sneaker Turnschuhe Schnürer Basic Plateauschuhe 825911 Schuhe
696	HERREN SCHUHE SNEAKERS NEW BALANCE [ ML373CO2 ]
697	Adidas Originals Hand-Burg Spzl Handball Hamburg Spezial Neu 44 2/3 UK 10
698	Adidas EQT Equipment Support 2005 44 2/3 neu ZX 8000 zx 9000 guidance cushion
699	Skechers Sport Dynamight 2.0 IN A FLASH Damen Air Cooled Slip on Sneaker schwarz
700	DOLOMITE DOL 54 Duffle Shoe Leichtwanderschuh Sneakers Freizeitschuhe
701	Converse Chuck Taylor All Star Unisex Sneaker Schuhe Archive Reptile 170104C
702	Skechers Sport Womens GRACEFUL GET CONNECTED WIDE FIT Sneakers Damen Schwarz
703	Unisex Schwarz Blau 2022Vans Old Skool Sneaker Skate viele Farben Gr.35-45
704	Herren Schuhe adidas TERREX FOLGIAN HIKE FV6823
705	NEU SKECHERS Damen Fitness Sneakers Slipper Loafer GO WALK 4 - INSPIRE Schwarz
