Record Number	Title
4898	Nike Dunk Low Light Smoke Grey EU 38,5 US 7,5 W / 6M | NEU & DS | Händler
4899	Moncler Herrenschuh 43
4900	ASICS Damen Gel Quantum 180 4 Schwarz Weiß Größe 7.5 US
4901	Puma Anzarun Lite Runner Sneaker Laufschuhe Turnschuhe
4902	STRANDFEIN Damen-Sneaker echt Leder Satin Perlen Schnürung Weiß 318307 Größe 36
4903	Puma R78 Unisex Sneaker Low Top Turnschuhe 373117 Beetroot Purple 04
4904	NEU SKECHERS Damen Fitness Sneaker Slip-On Schuh GO WALK LITE - BREAKOUT Schwarz
4905	On Sportschuhe Herren Schwarz NEU & OVP 219840
4906	Skechers Sport Herren TRACK BUCOLO Sneakers Men Schwarz
4907	Adidas Originals Sneaker Court Vantage Adicolor Hellblau Schnürschuhe S80255
4908	adidas Originals Never Made Pack Limited Men Sneaker Herren Schuhe
4909	NORTHWAVE SCREAM SRS GR . 47
4910	Navy H.I.S. HIS Shine Freizeitschuhe Leinen Schuhe Punk Jeans Baskets 41 42 44
4911	HERREN SCHUHE SNEAKERS NEW BALANCE [ ML574HMK ]
4912	Fila Damen Sportschuhe Sneaker EUR 40 Nr . 22-J 2519
4913	VANS ATWOOD HI Größe 39 US 7 ( MTE ) BROWN WHITE VN-O VG3DX4 TOP NEU
4914	Dunlop Front Trainer Crack Oil Wax Leather Unisex Sneaker 05180012b weiß-blau
4915	Nike Air Jordan 1 Retro Low OG SP Travis Scott Mocha - EU 44 / US 10 - braun
4916	adidas allround
4917	Adidas Superstar Kingsman Mr.Porter Size 10,5
4918	Converse Chuck Taylor All Star I Stand For High Unisex Schnürschuhe Sneaker Weiß
4919	Skechers Dynamight 2.0 - Eye to Eye Damen Schuhe Sneaker 12964 ( Schwarz-BKW )
4920	Nike Air Jordan Mars 270 Paris Gr .45 Schuhe CN2218 600 Neu Sneaker Basketball
4921	Skechers DEPTH CHARGE DRANGO Herren Sneaker Outdoor Schuhe taupe beige
4922	adidas Herren Schuhe Runfalcon 2.0 Herrenschuhe Sneaker Turnschuhe
4923	Puma HYBRID NX Herren Laufschuhe Fitnessschuhe Sneaker 192259 Peacoat Blau
4924	Saucony JAZZ ORIGINAL Sneaker Schnürschuh Halbschuh grey-teal S2044-615
4925	adidas Originals ZX 1000 C , Retro-Sneaker A-ZX Reihe , Gr . 42 2/3 , FW1485
4926	Damen Sneaker Weiß leichte Alltags Sommer Schuhe flach Atmungsaktiv Slipper
4927	Nike Air Max Plus Sneaker Schuhe Herren Sportschuhe Grau
4928	Damen Sneakers Low Zierperlen Strass Satinoptik Samtoptik Schuhe 818403 Mode
4929	Nike AIR MAX ZEPHYR CT1682 001 Sneaker Sportschuhe Schuhe Grau Gelb Größe 45,5
4930	Joe Nimble Herren Barfusschuhe Barefoot Vibramsohle Sneaker - Gr .47 - schwarz
4931	Vans Tesella Schuhe schwarz / weiß Leder / VN-0-VOAFHV - Neu
4932	Puma Tarrytown Corduroy chocolate brown / white swan Schuhe / Sneaker 356597 01
4933	adidas Stan Smith Dragon Print ( EH2237 ) Schwarz Sneakers Trainers NEU OVP
4934	K-Swiss Granada Herren Schuhe Sneaker Turnschuhe 06927 ( Blau 422 )
4935	Camper Sneaker Peu Cami Grün
4936	Nike Air Force 1 '07 Triple White CW2288-111 in vielen Größen mit OVP Neu !!!
4937	Marc O`Polo Herren-Leder-Sneaker Gr .43 - Neu -
4938	Adidas NMD R1 W Damen Sneaker Turnschuhe Schuhe grau grün FV8731 Gr . 36 - 42 NEU
4939	Nike Air Max 95 White Multicolor Women ( DJ4594-100 ) Sneakers Trainers NEU OVP
4940	Nike Air Force 1 fertig / gay
4941	Damen Plateau Sneaker Turnschuhe Halbschuhe Strick Freizeitschuhe Derby
4942	GANT CRUZ [ GR . 41 / 42 / 43 / 44 / 45 ] CANVAS SLIPPER SNEAKER CREME WEIß NEU OVP
4943	ADIDAS U_PATH RUN Herrenschuh Sneaker Sport Turnschuh Laufschuh Schwarz TOP
4944	Nike Air Max Command CD0873-001 Gr .38,5,39,40,5 Damen Sneaker Freizeit NEU Leder
4945	DOLOMITE Schuhe Cinquantaquattro low grau ( MUD / GREEN ) Gr . 42 UK 8 USA 9 NP129 €
4946	NEU SKECHERS Damen Sneakers Turnschuhe Freizeitschuhe Slip-On WSERENE Schwarz
4947	Skechers 42/42 ,5 ( Steht Gr .41 ) Damen Schuhe Leicht Neuwertig S 201446
4948	KAPPA BRIGHT MID LIGHT Herrenschuhe Winterschuhe Turnschuhe Beige 242075 / 4141
4949	adidas Originals Stan Smith Turnschuhe Sneaker Low Leder Schuhe Freizeit Weiß
4950	PUMA CELL REGULATE BOLD Sneaker Laufschuhe Turnschuhe Herrenschuhe
4951	Puma Smash Vulc V3 LO Herren Sneaker Turnschuhe Schuhe 380752
4952	Adidas Continental 80s Baara Grau Herren Low-Top Sneakers Freizeitschuhe Schuhe
4953	NIKE SB FREE 38.5-48 .5 NEU 125 € skate janoski koston 4.0 3.0 rosherun rosheone
4954	adidas Performance Crazychaos Sneaker Freizeitschuhe Schuhe Damen
4955	Nike Epic React Flyknit 2 Herren Schwarz Schuhe Sneaker Laufschuhe BQ8928 002
4956	Adidas Duramo SL Damen Laufschuh Running Shoe schwarz / weiß
4957	Adidas Sleek Super Damen Sneaker White Crystal Core Black EUR 39 1 / 3
4958	Asics GEL-KAYANO 25 NYC 1012A035-001 Damen Schuhe Sneaker Laufschuhe Schwarz
4959	FILA Sneakers Damen Freizeitschuhe Turnschuhe Gr . DE 36 Kunstleder pink # 35b83e6
4960	British Knights Roco Unisex Sneaker | Turnschuh | Sportschuh | Canvas - NEU
4961	Fila Disruptor Zero Damen Gardenia Sneaker Mode - 38.5 EU
4962	Diadora Herren Eagle 3 V Unisex Sneaker Turnschuh Schwarz Klettverschluss
4963	HERREN SCHUHE SNEAKERS PUMA SUEDE CLASSIC XXI [ 374915 01 ]
4964	SKECHERS BOBS SQUAD - Starry Love Damen Sneaker low Herzen Textil gepolstert
4965	ADIDAS ZX 500 2.0 Originals Women Sneaker Sporstschuh schuhe Gr . 36 2/3 NEU
4966	adidasTerrex Swift R2 Männer Schuhe Trekking G26558
4967	Finn Comfort Damen Sneaker Freizeitschuhe Halbschuhe Comfortschuhe Rot Gr . 39
4968	NEU Converse Pro Leather Hi Größe 42 Chuck Taylor Sneaker Schuhe Boots 169024C
4969	Neon Luftpolster Turnschuhe Schuhe Sneaker Boots Sportschuhe Unisex 098
4970	NEU SKECHERS Herren Sneakers Turnschuh Schnürer Memory Foam SKECH-FLEX 2.0 Black
4971	Adidas Haiwee J EF5778 Junior / Damen Sportschuhe Sneaker
4972	Nike air ACG , Schwarz , 44.5 , Neuwertig , Rarer Schuh . Super robust und stylish .
4973	Herren Damen High Top Sneakers Kult Sportschuhe Schnürer 98774 Trendy Neu
4974	Adidas ZX FLUX S82695 Schuhe Sneaker Turnschuhe Damen Jungen Freizeit Schwarz
4975	NEU BLK Black Sneaker Schnürer echt Leder cognac MADE in Portugal 37 - 42
4976	Think Schuhe 41,5 Slipper schwarz Herren / Damen sehr gut erhalten
4977	Damen Sneaker Bequeme Basic Freizeit Schuhe Turnschuh Schnürer 823103 Trendy Neu
4978	Onitsuka Tiger Fabre Classic Tm Herren Casual Retro Schuhe Sneaker 1183A782-100
4979	Adidas Original Beckenbauer Turnschuhe - Brown / Beige - G96460 - Größe Eu 7-12
4980	Damen Slip Ons Sportschuhe Profil-Sohle Sportliche Strick Schuhe 901370 Mode
4981	adidas Kaptir Super Sneaker Freizeitschuhe Fitnessshuhe Herrenschuhe FZ2870
4982	Schwarz Weiß Feiyue Schuhe für Kung Fu Wushu Kampfkunst Tai Canvas Sneaker STOCK
4983	Pantofola d ´ Oro Montefino Uomo Low White Herren Sneaker
4984	HERREN SCHUHE SNEAKERS UNDER ARMOUR HOVR SONIC 4 [ 3023543 004 ]
4985	Camel Active Avon Herren Sneaker | Turnschuh | Sportschuh | Veloursleder ( Suede )
4986	Adidas Lite Racer Sportschuhe [ F34685 ] Unisex
4987	Michael Kors Schuhe Sneaker Wilma Trainer Heavy Canvas Gr .39 Neu
4988	New Balance ML574 warmer Winter Sneaker Fleece Fellfutter 574 Herren Schuhe NEU
4989	Nike Zoom Live II Herren Basketball Schuhe Sneaker AH7566-400 Neu Sport 40
4990	Nike Air Force 180 Herren Halbschuh Sneaker Sportschuh Schwarz Gr . 42,5 ( UK 8 )
4991	DAMEN H750N 7272 GEL-LYTE KOMACHI PEACH BEIGE SNEAKER SCHUH Gr . 38 NEU
4992	Sneaker 38 beige sand Tamaris Schnürung Textil Plateauabsatz 23731
4993	WODEN Sneaker Ydun Croco Echtleder neu Gr . 37
4994	Lonsdale Camden Herren Leder Schuhe 41 42 43 44 45 46 47 48 49 50 Sneaker neu
4995	892811 Damen Sneakers Sportschuhe Freizeit Schuhe
4996	Adidas Raf Simons Sneakers
4997	Ludwig Reiter Andalusier , Nubuk navy Schuhe Damen Gr . 39 NEU
4998	Adidas Superstar Laceless / Adidas Originals / Adidas Sneaker / weiß / schwarz / FV3017
4999	HUGO BOSS Herren Schuhe Schnürschuhe Sneaker Velocity Runn rbmx2
5000	Herren Trekking Schuhe Outdoor Sneaker Sportschuhe Wanderschuh Big Size U37
5001	NIKE FREE RUN 3 SHIELD 5.0 SNEAKERS LAUFSCHUHE GR . EU 46 US 12 UK 11 30 CM
5002	DAMEN SCHUHE 153351 SNEAKER WEISS 38 NEU
5003	Converse Sneakers Damen Gr . DE 36 Leder grau # 96da072
5004	Adidas Freizeitschuh Gr UK 9
5005	K Swiss Schuhe schwarz Leder größe 41 low sneaker Newport 02160002 schwarz-weiß
5006	920268 Boras Lancaster Sneaker Leder white black 36
5007	Supra Skytop Herren Grau Sneakers Rund Leder Skate Schuhe EU 42
5008	Puma Creeper , Beige , Gr . 35,5
5009	Herren Gesundheitsschuhe - COMFORT WALK - Aktivschuhe Aktivsohle Fitness Gr . 45
5010	Filling Pieces Avatar Black 41 42 Projects Sneaker Schuhe Supreme Common
5011	Giesswein MERINO Runner Women Damen Wolle Schuhe Sneaker Schnürschuhe Gr . 39
5012	DAMEN Schuhe 35233 Sneakers Beige 37 NEW
5013	Adidas Kevin Garnett BELIEVE Schuhe Shoes Basketball Gr . 6 1/2 ( 40 )
5014	Schuh Paket 8Paar Nike Ugg Adidas Puma Chucks 34 36 37 38 Mädchen Sneaker Schuhe
5015	Nike Air Max Sage Low White Gr .38
5016	New Balance WL574CB WL574CB grau halbschuhe
5017	Nike Air Max 270 Tiger Schwarz University Gold Gelb Hot Punch Weiß AH8050-004
5018	HOGAN DAMENSCHUHE TURNSCHUHE DAMEN LEDER SCHUHE SNEAKERS NEU INTERACTIVE CUO 211
5019	Skechers Shape-ups . Damen Sportschuhe Gr .38 . Neuwertig !
5020	Converse allstar Größe 8 Größe 40 braun - kariert - ZOE
5021	REEBOK Classic CL Mesh Sneaker 43 Schwarz Weiß Schuhe Vintage Retro 2010
5022	Fit For Fun Abrollschuhe Gr . 39
5023	DAMEN SCHUHE 32219 SNEAKERS GRAU 39 * HOT *
5024	Nike Tiempo Rio IC Herren Indoor Fussballschuhe * 509039 013 * EUR 42,5 - neuw .
5025	NEU HERRENSCHUHE FREIZEITSCHUHE 78sr USED LOOK SCHNÜRER Gr 37 Schwarz Grau |
5026	Sylt ~ Schuh ~ Sneaker ~ Leinenschuh ~ unisex ~ Gr : 40
5027	Adidas ZX 750 Turnschuh Sportschuh Sneaker in UK 10 o. FR 44 2/3
5028	Damen Schuhe Stieffletten Zara Gr .37 ❤ Top Zustand
5029	New Balance Sneakers Damen Freizeitschuhe Turnschuhe Gr . DE 42.5 Kun ... # 19f7d45
5030	Jack & Jones Schuhe Gr .41 guter Zustand
5031	Neuer Herren Nike Air Max Schwarz Größe 42,5 Neu
5032	ADIDAS Pharrell HU Tennis 2017 Schuh NEU , Gelb Weiss , UK 8.5 EU 42 2/3
5033	( FPSV ) Vans 106 VULCANIZED Classics hiker black waterfall 47.0
5034	DAMEN SCHUHE 65768 SNEAKERS SCHWARZ 40 HOT
5035	Braking Mocassino in Pelle Nero da Uomo 6517 105800
5036	Größe 12 Onitsuka Tiger Mexico 66 Herren Leder Sneaker Schuhe Damen 13.5
5037	Adidas Originals Taekwondo Schuhe W EU 38 US 6 1/2 UK 5 NEU Kampfsport Team
5038	Bisgaard Sneaker , EUR 26 , Silber , Kinder
5039	Nike Air Max 270 Gr .45 Ovp
5040	puma SF DRIFT CAT 7 JR 36418102 Mastersport
5041	Adidas Superstar Rosegold 40 2/3 SUPER ZUSTAND
5042	VANS SK8 Mittelhoch Wildleder Fransen Größe 9.5 M EU 40.5 Frauen Skate Mokassin
5043	Sneaker , Rolling soft , Gabor , 38 , grau , Turnschuh , Wildleder , Textill
5044	eS SAL navy white gum Sneaker blau Schuhe
5045	Vagabond Stiefeletten in petrol blau echt Leder Gr . 41 !!
5046	Herren Sneakers Sportschuhe Lederoptik Freizeit Schuhe Klettverschluss 76730
5047	Ed hardy * Slipper * Schlüpfschuh * Gr . 40
5048	Nike Air Max 270 M AH8050-005 Schuhe schwarz
5049	Nike Capri Low Sneaker Schuhe 46 US12 UK11 Weiß Gold Canvas Leder
5050	Converse-Schuhe blau
5051	Sportschuhe Gr . 46 Nike Classic free Style Cortez weiß blau & Kult Leder Sneaker
5052	SUPERGA Sneakers Damen Freizeitschuhe Turnschuhe Gr . DE 40 kein Etik ... #d 1ccdf8
5053	ORIGINAL ADIDAS KAPTIR 2.0 H00279 HERREN TURNSCHUHE SNEAKER FITNESS SCHWARZ
5054	Adidas Sportschuhe , US Gr . 7 1/2 , EU 38
5055	Laura Scott Sneakers Damen Freizeitschuhe Turnschuhe Gr . DE 40 schwarz # 9dbfc12
5056	Nike Herren Kb Mentality Schwarz Laufschuhe 45
5057	Lands ' End Damen Schuhe , Turnschuhe , Sneaker Gr . 37.5
5058	Boxfresh Schnürer Gr . 40 UK 6 schwarz Sneakers Turnschuhe
5059	454340-100 Nike SHOX JUNIOR [ US 8 ]
5060	Sneaker in Gr . 3 1/2 oder 36 Weite G von CAPRICE aus Echtleder ##
5061	DAMEN SCHUHE 130508 SNEAKERS ROSA 38 NEU
5062	Schöne NIKE Sportschuhe Gr .38,5 NP :90 € ne
5063	Fila Sneaker , Freizeitschuhe Gr .42 Rot , viel getragen , Sammler
5064	Herrenschuhe Converse All Star Hi Leinenschuhe Größe UK 3-11 Damen Old Silber
5065	TOP DAMEN SCHUHE 51641 SNEAKERS ROT 38 NEUES MODELL
5066	NIke Air Jordan 6 Retro Tinker 384664-104 US 10.5 - 12
5067	Mokassin , Loafer , Tods , Alessandro Del Aqua , Sneaker , schwarz , Weiss , Grösse 42
5068	Converse 38 all star sammler
5069	Air Jordan 1 Trainer Basketballschuhe Blue Sneaker EUR 36-45 Low Cut Schuhe
5070	Polo Ralph Lauren Sneakers Herren Freizeitschuhe Turnschuhe Gr . DE 4 ... #d 55b8dc
5071	DVS Endeavor Black Suede Gr . 41-47 Skate Schuhe Shoes
5072	Nike Air Zoom Terra Kiger 6 Herrenschuhe Neu Gr . 44 ( CW2639-001 ) Trail
5073	ETNIES JAMESON 2 ECO BLACK WASH
5074	Kennel & Schmenger Gr .37,5 SneakerSchwarz ( neu ) Stylish Sehr hoher NP !
5075	Air Jordan Flight Club 91 Herren Sneaker DC7329-106 Sport Basketball Schuhe Weiß
5076	Converse All Star Chucks blau jeansblau 5 37,5
5077	Nike Schuhe AIR MAX 90 ESSENTIAL / 537384-108 Herren Sneaker Schuh Weiß BWARE EU45
5078	Mustang Herren Schuhe Sneaker Slipper Turnschuhe Herrenschuhe Männer 4132-301
5079	Puma Unisex Sneaker Respin 374891
5080	Geox Respira Schuhe in der Größe 41
5081	art. 943 / SNEAKER SCHUHE SLIPPER SCHNÜRER BOOTS NEU G. 40
5082	Nike Sneakers Damen Freizeitschuhe Turnschuhe Gr . DE 43 kein Etikett ... #afbae 8c
5083	Puma Basket Platform Reset W Schuhe
5084	REEBOK CLASSIC LEATHER MUNCHIES PACK PEANUT BUTTER & JELLY BD1926
5085	[ NEU ] Nike Jordan CP3 VIII AE Gr 42 white / game royal / red / cool blue 725173 107
5086	TRENDY DAMEN SCHUHE 140443 SPORTSCHUHE ROT WEISS 40 TOPAKTUELL
5087	Original Nike Air Max Ltd 2 Gr .46
5088	Timberland 43155 PATHLITE LOW GTX , Outdoor Schuhe 43,5
5089	ECCO Ultra Trail grau NEU GORE-TEX ® Gr . 46 / 12-12 ,5
5090	Sneaker Turnschuhe Sportschuhe super leichte Schuhe Teil weiße Sohle @ 2636x
5091	Damen Sneaker PUMA VIKKY LS weiß rot Gr . 40 sehr gut ! Wie neu
5092	original adidas NMD R1 # Schuhe # Sportschuh # Gr . 42,5 # NEU # Sneaker
5093	NEU adidas Herren Boots Schuhe Größe 42 2/3 Sneaker G07032 black white TOP
5094	Nike Blazer Original Schwarz Weiss Gr . 38
5095	Damen Schnür-Sneaker Größe 39 , Farbe bordeaux
5096	Adidas x Pharrell Williams Human Race NMD in Größe EU40 / US7 BB6959 NEU
5097	Converse , Grau , Gr . 7
5098	Converse STAR PLYR EV OX US 10,5 EURO 44,5 Black Milk Sneaker Schuhe Player
5099	Adidas UlTIMAFUSION Damen Gr .38 2/3 NEU Laufschuhe Sportschuhe Training Freizeit
5100	Adidas Sportschuhe Samoa Größe 7 bzw . 40 2/3 - Damen - Creme / Weinrot
5101	Adidas Trekking / Outdoor / Wanderschuhe Gr .5,5 ( 38 ) TOP
5102	Original Convers aus USA
5103	Vans WINSTON Girls Active suede dress blues white EUR 40,5
5104	Nike Air Jordan 1 MID SE ( GS ) EUR 40 ( DR6967071 )
5105	VANS Atwood 38,5 UK 5,5 schwarz orange Men Jungen Sneaker Leder
5106	Damen Herren Kinder Sneakers Viele Farben Sportschuhe Schnürschuhe 816719 Schuhe
5107	Nike Air Max 98 Total Crimson Wolf Grau 640744 006 Neu Verpackt UK Größen 12 , 11
5108	REEBOK PUMP IT UP ! Menschen Schwarz Stoff PUMP OMNI LITE TECH Sneakers Neu
5109	adidas NEO Sneakers Herren Gr . UK 9 ( DE 43 ) grau # 4e3b377
5110	Lasocki 39 Leder
5111	blaue New Balance Turnschuhe - Modell 520 - Größe 45 EU
5112	Skechers Diameter - Murilo Herren US 9 Braun Turnschuhe Gebraucht 4229
5113	GABOR Sehr schöne Schnürschuhe , Sneaker , Damenschuhe , Größe 39
5114	Nike Sneakers Damen Freizeitschuhe Turnschuhe Gr . DE 40 Kunstleder , ... #f 3c2819
5115	Puma Speed Cat / Race Cat HI GR .40 für Damen * absolut Neuwertig *
5116	Jana Sneaker Damen Classic Schnürschuhe
5117	Nike Air Max Invigor Jacquard Sneaker Herren Schuhe EUR 43 + NEU +
5118	Paul Green Damen Sneaker 39 Leder braun Schnürboots mit Schnallen
5119	Nike Shox blau , weissGrösse 45
5120	Camper Chasis K100280-004 Sneaker Herren Schwarz
5121	Nike Air Shox 46 / US12 Nubuk Mesh Schwarz * Fast NEU * Herren
5122	adidas V29253 CC Chill M Gr . 44 neu und ungetragen 30 €
5123	RAR : original CONVERSE Chucks All Stars Light Acoustic HI Gr . 42,5 WMN neuwertig
5124	Schuhe Nike Kaishi 2.0 Special Edition 844838 001 Sneakers Herren Black - Blu dr
5125	puma men watt idp rhabarberschwarze laufschuhe ( rot ) - D6p
5126	adidas Herrenschuhe Adi Racer Low Größe UK 7 / Eur 40.2 / 3
5127	Nike Air Vapormax 97 EUR 43 !!! RARITÄT !!! Black Reflect Schwarz WMNS MAX
5128	BRANDNEU HERREN SCHUHE 54106 SNEAKERS SCHWARZ 44
5129	Kennel Schmenger Sneakers Damen Freizeitschuhe Turnschuhe Gr . UK 5.5 ... #dfcece 0
5130	Paul Green Sneakers Damen Freizeitschuhe Turnschuhe Gr . UK 4.5 ( DE 3 ... # 0df6532
5131	PHILIPPE MODEL Herren Sneaker Schuhe Gr . 43 44 grau gelb - 1A Zustand !
5132	* Converse Chucks passen bei Gr . 37/38 *
5133	adidas schuhe tubular Gr . 45
5134	GOOD YEAR Brauner Sportschuh Gr . 7 ( 40 ) wie neu ! HINGUCKER !
5135	Nike Air Force 1 '07 Herren Sneaker - Weiß / Weiß , ( 315122-111 ) EU 45 , US 11
5136	G. K. MAYER Plateau-Sneakers Gr . 37 schwarz / rot / gold Leder NEUwertig
5137	NEU SKECHERS Damen Sneakers Loafer Slipper Slip On GO SLEEK - SLIDE Beige / Grau
5138	SNEAKERS FREIZEITSCHUHE DAMENSCHUHE DESIGNER NEU Gr 37 Silber 2885 |
5139	Sneaker von Adidas Sleek Edition , Schwarz / Violett / Silber Gr . UK 6 1/2
5140	puma schuhe gr 41 neu
5141	NIKE BLAZER MID PRM / EU 44 , US 10 , UK 9 / ( Grau / Weiß ) NEU
5142	Nike Juvenate faded olive EUR 45 UK 10
5143	Hübsche Schöne Herren Nike Roshe One Schuhe Gr . 44,5
5144	adidas Originals Sneakers Herren Freizeitschuhe Turnschuhe Gr . UK 10 ... #d 1a83c7
5145	Mizuno Men 's Wave Inspire 16 Road Running Shoe , Black , Size 9.5 K7sH US
5146	Herren Sneakers Low Profilsohle Freizeit Turnschuhe Schnürer 79428 Trendy Neu
5147	Nike Air Jordan 1 high 41 og seafoam , einmal getragen , Topzustand , Releasekauf !!
5148	Skechers Damen Flex Beschwerde 2.0 Dreist Move Turnschuh
5149	Nike Air Max 90 BSMNT Manchester Gr .45,5 Neu mit Rechnung
5150	ADIDAS CHAUSSURE ZX FLUX - GRAU - 9 ( 4054067316730 )
5151	ADIDAS BASKET SNEAKER PRO MODEL TORSION █ US 10,5 █ GAYLE TEILE █ ( SUPERSTAR ? )
5152	adidas zx flux Ba 7642 gr 37,5 neu
5153	Energie Sneaker Schuhe Gr . 40 schwarz-grün , super Style
5154	[ F352 ] Converse Chuck Taylor Gr . 37,5 UK 5 All Star Specialty Hi
5155	Adidas Zx Speed Sneaker Schuhe black Gr . 44 neu
5156	S.Oliver Schuh in Gr . 41 beige **** NEU ***** trendy & gemütlich
5157	Aktuelle Damen Freizeitschuhe Schuhe Sneakers 88053 Silber 38
5158	Vans Damen Sportschuhe Sneaker US 7,5 Nr . 22-J 3799
5159	Skechers Go Walk Damen US 10 Grau Wanderschuh Gebraucht Makel 4200
5160	Jordan True Flight BLACK / INFRARED 23 / ANTHRACITE - Gr .12 / EU46 - NEUWERTIG
5161	adidas Cloudfoam 8tis Herren Turnschuhe UK 8 US 8.5 EU 42 Ref 4525 ^
5162	BAMA Damen Sneaker Freizeitschuhe Halbschuhe Comfortschuhe Rot Gr . 39 ( UK6 )
5163	Ruco Line Nicki Damen US 7 Weiß Turnschuhe Makel 4763
5164	Nike Wmns Internationalist QS Nagoya Marathon ( 695754-001 ) US 7.5
5165	Adidas Damen Schuhe " Neu " Gr .39
5166	ADIDAS Terrex AX3 Herren Schuhe Trekking Wandern Outdoor , G26563 / M3
5167	Nike Hypervenom Gebraucht Größe 42,5 Guter Zustand
5168	hummel schuhe lila ein mal getragen
5169	Puma Herren Sneaker Trinomic XT S Speckle Rio Red-Black
5170	Vans Atwood 40,5 Damen Schuhe Grau
5171	Sean John Mens Murano HI Fabric Hight Top Lace Up , Navy / White , Size 7.0 wbMR US
5172	TOMMY HILFIGER VICTORIA 1D [ GR . 41 ] DAMEN CANVAS SNEAKER BEIGE NEU & OVP
5173	Tolle Sneaker von Kennel & Schmenger , Gr . 5,5 , Gr . 38 Anthrazit Metallic / schwarz
5174	Nike Free 3.0 V3 Neu OVP blau ungetragen Größe 45 ( US : 11 ) Laufschuhe
5175	Vans Authentic Hi , Senakers , Schuhe , Größe 40/41 , schwarz , UVP € 69,99 NEU
5176	ORIGINAL ADIDAS SUPERSTAR W FV3285 DAMEN SNEAKER TURNSCHUHE FITNESS SPORT WEISS
5177	Suede Trim
5178	GEOX sale 69K D WINT.LURAS sneakerss sale
5179	Gio-Goi Tibst 4 Marineblau Suede Lace Up Trainer Männer ( M-10400 )
5180	Weiße Schuhe Memphis One Größe 44 SCHICK
5181	Neue orig . Lacoste Schuhe PROTECT RT weiß / blau Gr . 43
5182	Nike Thea Air Max Blau 39
5183	adidas Originals Sneakers Herren Freizeitschuhe Turnschuhe Gr . UK 9 .... #be 49adb
5184	Reebok Ridgerider Trail 2.0 SPORTSCHUHE 44,5
5185	Nike Dart 9 W running gr 40 FRAUEN SPORT-SCHUHE
5186	Converse Nylon Trainer Damen Schuhe Sneaker 1J349 weiß-rot
5187	tolle original Reebok Herren Schuhe , Gr . 44,5 , dkl . blau , neu
5188	adidas Superstar Originals Schuhe Sneakers weiß / schwarz C77124 EUR 38 2/3 US 6
5189	Adidas Damen Advantage Bold Weißer Synthetik Sneaker
5190	HERREN Schuhe 35043 Sneakers Halbschuhe Rot 42 HOT *
5191	Herren Damen Schuhe NIKE DUNK LOW Retro Weiß / Schwarz DD1391-100 DE
5192	ASH Sneaker Gr . D 40 Schwarz Damen Schuhe Turnschuhe Shoes Leder Leather
5193	AH by Android Homme Drift Herren Grau Turnschuhe Schuhe Neu / Display EU 42,5
5194	Damen Laufschuhe VANS UA ISO 1.5 ( MESH ) , Farbe Weiß
5195	Tamaris Sneaker Fashletics 41 yellow guter Zustand
5196	Nike Air Affect
5197	Geile Nike Air Max Tavas 47,5
5198	NMD r1 primeknit Herren Gr . 44 2/3 bzw . 10 1/2
5199	Damen Sportschuhe Laufschuhe Runners Sneakers Stoffschuhe 815609 Schuhe
5200	Adidas V Racer Nylon Selena Gomez Neo Label Damen Sneaker weiß / gold Q38992
5201	Esmara Damen Sneaker Turnschuhe Sportschuhe schwarz Plateau-Sohle Gr 41 bzw 7
5202	Converse Sneakers Damen Freizeitschuhe Turnschuhe Gr . DE 36 Leder sc ... # 493a31c
5203	Nike Downshifter 11 M CW3411-002 Laufschuh schwarz
5204	West Germany Vintage 70s Adidas TRX Series Size UK 5.5 Mint
5205	Original Nike Capri CNVS Rot Red Gr . 42.5 TOP
5206	adidas neo Damen Sneaker Schuhe hellgrau Gr . 37,5 UK 4,5 US 6 1a Zustand !
5207	FILA Sportschuhe Gr . 41
5208	Puma Cell , Sportschuhe , Schwarz / Weiss , Gr . 40,5
5209	Sneakers Freizeit - Schuhe mit Strass creme Größe 37 ( 22-149 )
5210	Schuhe für große Jungs - NIKE Air Max - schwarz / Größe 43 / Zustand gut !!
5211	Asics Damen Sneaker neuwertig Größe 42,5
5212	ASICS ONITSUKA TIGER Fabre BL-L Gr Leder Herren gelb-grün Mexico HN7H2-0486 NEU
5213	adidas Core Caflaire weiß / beige - Herren-Sneaker EG4303
5214	Boss Orange Sneaker Calmeso - EU 45 UK 11
5215	Ecco ST. 1 LIte M GTX GORE-TEX Gr41
5216	Neuwertige goldene Halbschuhe von Street in Gr .38
5217	orginal DSQUARED 2 Leder Sneaker Gr . 41 42 guter Zustand ! NP 359 , - €
5218	Herren Adidas Yezzi Boost350
5219	adidas ZX 9000 OG Torsion ( türkis / rot ) , G97754 , FR 47 1/3 , UK 12 , US 12 1/2
5220	K-SWISS Hof IV P MID VNZ sommer Sneaker schwarz Leder 03146002
5221	Puma tx-3 vintage xs 500 850 og suede US 10 EU 43 2 xt-2 xt-1 xt 1 2 disc blaze
5222	Imran Potato Lobster Exklusive Foam Runner Shoes Pink Comfortable US Size 10
5223	Converse Chucks Taylor All Star Slip on Damen Herren Schuhe Sneaker Turnschuhe
5224	Nike Adapt BB Mag US 10 / EUR 44 ( EU Charger ) . Habe ihn 2x da :)
5225	New Balance M530 Herren Synthetik Laufschuh 4340
5226	adidas Sneaker Unisex Schuhe EQT Support RF grau
5227	SCHUHE JACK&JONES STOFF BLAU Gr . 46 sehr guter Zustand 4x getragen
5228	Puma Speedcat Racing Gr . 36 Leder Sneaker Sportschuhe trendy Hingucker
5229	Sneakers High FREIZEITSCHUHE DAMENSCHUHE DESIGNER NEU Gr 40 Camel 6449 0 €
5230	Turnschuhe Sneakers von Flip Flop , Leder , beige , neuGr .40
5231	NIKE AIR MAX 97 BLACK GLITTER DAMEN EUR 38,5 US 7,5 Schwarz Glitzer
5232	NEUw ausgefallene OSIRIS BARRON GIRLS Damen CANVAS Skater SNEAKERS Gr . 37,5 - rar
5233	NEU Puma SF Future Cat Ultra Ferrari Gr . 41 Sneaker 306241-02 Motorsport
5234	Herren Sportschuhe MUNICH DYNAMO 32 111542 Grau
5235	BRONX Wedges Sneaker High Top Gr . 40 Weiß Neon Animal Taupe Frühling Turnschuh
5236	ADIDAS Neo * NEU * Größe 38 1/2
5237	Super Schuhe Von Puma Wie Neu ! 38
5238	Turnschuhe von Reebok mit heller Sohle ( für Bowling , Turnhalle etc. ) Gr . 38,5
5239	Saucony Triumph Iso 2 Damen US 9 Rosa Laufschuh Gebraucht 4147
5240	Neue adidas Herrenschuhe Sneaker NMD R1 PK BY1911 Primeknit Sneaker NEU
5241	Adidas Sneaker , schwarz / weiß , Gr . 43
5242	CAMPER UNO SNEAKERS DAMENSCHUHE SCHWARZ
5243	diesel schuh
5244	Adidas Rivalry Low Black Satin Mega Style EH0181 Gr . 41,5 Schuhe Sneaker
5245	Turnschuhe adidas neo Gr . 35 / 36 US 4,5 UK 4
5246	Nike 37,5 oldscool
5247	Adidas Originals Sneaker , Schuhe , Größe 42
5248	chucks All Star Converse limited Edition Glitzersteine Herz ❤ weiß Gr . 37,5 Neu
5249	NEU DESIGNER DAMENSCHUHE 7qe0 MOKASSIN PUMPS FREIZEITSCHUHE Gr 39 Rot |
5250	Prada Iconic Vitello PLUME Mens Trainers Sneakers Shoes Schuhe Turnschuhe Neu 43
5251	Neue Nike Flex Run Damen Laufschuhe , Gr . 38
5252	adidas Sneaker in beige / neon , Gr . 44
5253	Caspar SBO102 Damen Schuhe Metallic Plateu Sneaker Glitzer Strass 7 cm Absatz
5254	polo schuhe Neu 42
5255	New Balance W928 Damen Wei Breit Leder Wanderschuhe Gebraucht EU 43
5256	Nike Air Jordan 1 Royal 47.5 47
5257	Guess Tucci 2 Damen US 5.5 Grün Turnschuhe Ohne Karton 4575 EU 35,5
5258	Saucony Herren Shadow 5000 Wildledertrainer , Grau
5259	Neu MARCO TOZZI Damenschuhe Gr 40 High Top Sneaker gefüttert Stiefel Schuhe
5260	Adidas Turnschuhe Gr 40 Getragen weiß
5261	Puma Schuhe Gr . 40,5 Herren
5262	Nike Dunk Low College Navy Grey ( W ) : SKU : DD1768-400 - Size : ( W ) US 5 | EU 35.5
5263	Nike Sneakers Damen Freizeitschuhe Turnschuhe Gr . DE 42.5 Leder blau # 8766b07
5264	K-Swiss Clean Classic High P Men 's Herrenschuh Gr .43 Braun Sneaker Neu mitKarton
5265	Adidas adiprene Turnschuhe USA 10 EU gr44 UK 9,5
5266	☼ ☼ ☼ Superga , Sneaker , bronze glänzend , Gr . 39 , TOP ☼ ☼ ☼
5267	Nike Schuhe , schwarz
5268	Boxfresh Sneaker Herren Lederschuh Schnürschuh schwarz Leder
5269	Neu Converse Chucks All Star low Port Multi Sneaker Schuhe 542561F Gr .37,5 UK 5
5270	Reebok Zigkick Neo Damen US 10.5 Lila Laufschuh EU 42 4117
5271	Adidas Y-3 Boost QR Knit Yohji Yamamoto Herren Sneaker Schuhe Gr .44 NEU Original
5272	DAMEN SCHUHE 65392 SPORTSCHUHE GRAU SNAKE 38 NEW
5273	Buffalo London Classic High aus Nubukleder 1348-14 2.0 Gr . 39 NEU
5274	K-Swiss Tubes Comfort 200 Herren Schuhe Sneaker Turnschuhe 07112 ( Schwarz 011 )
5275	Sneaker LEONE grau / blau / orange Gr . 38
5276	Nike Internationalist 41 Blau Pink Grau Schuhe Turnschuhe Sneakers Free
5277	Nike Air Jordan 4 Infrared | OVP&NEU ✅ | EU 44.5
5278	ORG CONVERSE Chucks Sneaker beige all star Gr . 39 neuwertig
